SK_LINE_ITEM,OPPORTUNITY_ID,CALL_AMT,WON_AMT,UPSIDE_AMT,QUALIFY_PLUS_AMT,PROPOSE_PLUS_AMT,NEGOTIATE_PLUS_AMT,OPEN_PIPELINE_AMT,OPPORTUNITY_VALUE,PPA_AMT,PPV_AMT,PWP_PROB,CREATED_DATE,WEEK,QUARTER,YEAR,SNAPSHOT_LEVEL,RELATIVE_QUARTER_MNEUMONIC,SALES_STAGE,GEOGRAPHY,MARKET,SECTOR,ACCOUNT_TYPE,INDUSTRY,UT30_NAME,PRACTICE,DEAL_SIZE,IBM_GEN_AI_IND,PARTNER_GEN_AI_IND,SALES_WEEK_DESCRIPTION,NEXT_STEP,ACCOUNT_NAME,CLOSE_DATE,LAST_MODIFIED_DATE,OPPORTUNITY_NAME,CLOSE_QUARTER,CLOSE_MONTH,CLOSE_WEEK,CLOSE_YEAR,CLIENT_NAME,UT15_NAME,UT17_NAME,UT20_NAME
8193054,0063h00000Lo5HbAAJ,0.0,0.0,0.0,0.0,0.0,0.0,93000.0,93000.0,1525.0,0.0,0.01640804,2023-08-29,1,4,2023,W,CQ,Engage,APAC,ANZ,Australia PUB,Unassigned,Digital Squads,CT: Dialexa Product Engineering Standalone,Customer,small,0,0,2023Q4W01,,SWINBURNE UNIVERSITY,2023-12-28,2023-08-29,Swinburne Health & Wellbeing 360,4,12,14,2023,SWINBURNE UNIVERSITY OF TECHNOLOGY,Strategy & Technology,Hybrid Cloud & Data,Digital Product Design and Engineering
7644065,0063h00000KcmCeAAJ,0.0,0.0,0.0,0.0,0.0,0.0,0.0,700000.0,0.0,0.0,0.0,2023-02-18,14,4,2023,W,PQ,Lost,Rest of EMEA,Italy,Italy GOV HLTH,ENTERPRISE,Government,CSS: Threat Mgmt Svcs (Custom Mgd) 6950-21K Withdrawn,Cyber Threat Management,small,0,0,2023Q4W14,,PRESIDENZA DEL CONSIGLIO,2023-12-20,2023-09-15,Cyber Range,4,12,13,2023,ENTI CENTRALI,Intelligent Operations,Cybersecurity,IBM Cyber Threat Management
8311446,0063h00000LvjliAAB,0.0,0.0,0.0,1.0,0.0,0.0,1.0,1.0,0.0,0.0,0.0,2023-10-06,14,4,2023,W,PQ,Qualify,Rest of EMEA,France,France FSS,ENTERPRISE,Banking,App & Data modernization for Distributed Apps,Migration & Modernization,small,0,0,2023Q4W14,,EURO INFORMATION,2023-10-27,2023-10-06,Architectural Thinking @ E-I,4,10,5,2023,CREDITS MUTUELS,Strategy & Technology,Hybrid Cloud & Data,"Application Migration and Modernization (not AWS, Microsoft)"
2012133,0063h00000DJgfLAAT,0.0,0.0,0.0,0.0,0.0,0.0,5000000.0,5000000.0,64397.0,0.0,0.01287945,2019-09-11,1,4,2023,W,CQ,Engage,Americas,Canada,Canada Fin,ENTERPRISE,Banking,App & Data modernization for Distributed Apps with Red Hat,IBM & Red Hat,small,0,0,2023Q4W01,Oct 20 2022   Assembling team to build out POV for Q4 2022 with priority use cases on climate risk and internal lead generation,THE BANK OF NOVA SCOTIA,2023-11-24,2023-07-22,Wealth Management - Data Fabric Garage (Build),4,11,9,2023,SCOTIA BANK,Strategy & Technology,Hybrid Cloud & Data,"Application Migration and Modernization (not AWS, Microsoft)"
7948402,0063h00000KCoNaAAL,129448.0,129448.0,0.0,129448.0,129448.0,129448.0,0.0,129448.0,0.0,0.0,0.0,2023-03-05,14,4,2023,W,PQ,Won,APAC,ANZ,Australia FSS,TARGET PREMIER,Banking,Cloud Native App Development,Migration & Modernization,small,0,0,2023Q4W14,112  Staffing Plan agreed and CFO  CIO approval obtained Finalised SOW 2711123 and internal approvals completed 0812  BEN signing,BENDIGO & ADELAIDE BANK,2023-12-11,2023-12-11,BEN - PP&C & Microservices Extension (Q1-24) - 4 months,4,12,12,2023,BENDIGO ADELAIDE BANK,Strategy & Technology,Hybrid Cloud & Data,Digital Product Design and Engineering
2076838,0063h00000HEIH1AAP,0.0,0.0,0.0,0.0,0.0,0.0,0.0,600000.0,0.0,0.0,0.0,2022-01-05,1,4,2023,W,CQ,Lost,UKI,UKI Communications,UKI Telco,ENTERPRISE,Telecommunications,CT: Customer Transformation with Adobe,Adobe,small,0,0,2023Q4W01,Change in priorities across the CVM team has led to them changing direction and leveraging current investmentsConversation with budget holder and funds lacking for 2223 Included in 915 planning for next year,VODAFONE LIMITED,2023-11-24,2023-08-30,(OneComms) Omni-Channel Digital Journey Orchestration Phase 1,4,11,9,2023,VODAFONE,Strategy & Technology,Business Applications,Marketing Transformation
8105585,0063h00000Ksz4aAAB,0.0,0.0,0.0,0.0,0.0,0.0,0.0,500000.0,0.0,0.0,0.0,2023-07-25,14,4,2023,W,PQ,Lost,Americas,US Distribution,US TNT,PREMIER,Travel & Transportation,"OnPrem Application Development, DevOps & Hybrid Integration",Migration & Modernization,small,0,0,2023Q4W14,072523 Discussion is in progress on scope and timelines,MARRIOTT INTERNATIONAL INC,2023-10-27,2023-10-01,HotelOps QE Team,4,10,5,2023,MARRIOTT INTERNATIONAL INC.,Strategy & Technology,Hybrid Cloud & Data,Digital Product Design and Engineering
7844707,0063h00000KfGEgAAN,0.0,0.0,100000.0,100000.0,100000.0,0.0,100000.0,100000.0,41824.0,81937.0,0.41824964,2023-04-21,1,4,2023,W,CQ,Propose,UKI,UKI Industrial,Ireland INDU,Unassigned,Digital Squads,FSCT: Acquisition Simpler Consulting,Finance,small,0,0,2023Q4W01,Sep 2023  PH  meeting Thermo leadership Simpler support on pause due to financial policy in Wider group,THERMO FISHER SCIENTIFIC EMEA,2023-10-27,2023-09-14,Simpler EMEA –  Thermofisher Business System extension #2,4,10,5,2023,THERMO FISHER SCIENTIFIC,Strategy & Technology,Strategy & Transformation,Supply Chain Transformation
7249556,0063h00000J9MTjAAN,0.0,0.0,0.0,0.0,0.0,0.0,0.0,2000000.0,0.0,0.0,0.0,2022-08-10,14,4,2023,W,PQ,Lost,Americas,US Communications & Industrial,US Communications & Industrial,ENTERPRISE,Energy & Utilities,App & Data Modernization on Mainframe - No Cloud,Migration & Modernization,small,0,0,2023Q4W14,,NATIONAL GRID USA SERVICE COMPANY,2023-11-30,2023-11-09,DevOps Transformation - Phase 1,4,11,10,2023,NATIONAL GRID TRANSCO PLC,Strategy & Technology,Hybrid Cloud & Data,Mainframe Application Modernization
7644065,0063h00000KcmCeAAJ,0.0,0.0,0.0,0.0,0.0,0.0,0.0,700000.0,0.0,0.0,0.0,2023-02-18,1,4,2023,W,CQ,Lost,Rest of EMEA,Italy,Italy GOV HLTH,ENTERPRISE,Government,CSS: Threat Mgmt Svcs (Custom Mgd) 6950-21K Withdrawn,Cyber Threat Management,small,0,0,2023Q4W01,,PRESIDENZA DEL CONSIGLIO,2023-12-20,2023-09-15,Cyber Range,4,12,13,2023,ENTI CENTRALI,Intelligent Operations,Cybersecurity,IBM Cyber Threat Management
8243875,0063h00000LLEdsAAH,0.0,0.0,2835.0,2835.0,2835.0,0.0,2835.0,2835.0,1801.0,3235.0,0.63546395,2023-09-13,1,4,2023,W,CQ,Propose,Rest of EMEA,NCEE,CEE,PREMIER,Select BPS-T,Application Maintenance and Management - OnPrem,Custom Application Operations,small,0,0,2023Q4W01,,BANK BPH SPOLKA AKCYJNA,2023-12-31,2023-09-29,CR 087 (527) SWIFT November Release regresja,4,12,14,2023,GENERAL ELECTRIC,Intelligent Operations,Application Operations,Custom Application Management Services
8208569,0063h00000Luik7AAB,0.0,0.0,0.0,0.0,0.0,0.0,0.0,1375000.0,0.0,0.0,0.0,2023-09-01,14,4,2023,W,PQ,Lost,Americas,US Financial,US Financial,Unassigned,Select Technology Sales Rep,DTT: Risk & Compliance Advisory,Promontory,small,0,0,2023Q4W14,1012 Client still in decisionmaking mode,SUMITOMO BANK LEASING AND FINANCE,2023-10-31,2023-10-23,PFG CPG - Compliance Risk Assessment Support,4,10,6,2023,SUMITOMO MITSUI FINANCIAL GROUP,Strategy & Technology,Hybrid Cloud & Data,"AI Integration Services (with IBM, AWS, Microsoft)"
6876314,0063h00000HDedQAAT,0.0,0.0,0.0,2333333.0,0.0,0.0,2333333.0,2333333.0,34832.0,71361.0,0.01492819,2021-12-15,1,4,2023,W,CQ,Qualify,Americas,Canada,Canada PUB,Unassigned,Digital Squads,HRTT: HR Transformation with SAP SuccessFactors,SAP,small,0,0,2023Q4W01,,REGIONAL MUNICIPALITY OF WOOD,2023-12-29,2023-02-08,Wood Buffalo - SuccessFactors Payroll and Time,4,12,14,2023,MUNICIPALITY OF WOOD BUFFALO,Strategy & Technology,Business Applications,HR Technology
7203821,0063h00000JEQTCAA5,0.0,0.0,0.0,0.0,0.0,0.0,0.0,2000000.0,0.0,0.0,0.0,2022-09-07,1,4,2023,W,CQ,Lost,Rest of EMEA,Italy,Italy FSS,TARGET ENTERPRISE,Banking,App & Data Migration Services,Migration & Modernization,small,0,0,2023Q4W01,,UNICREDIT SERVICES,2023-12-31,2023-07-10,AWS Cloud Migration Factory,4,12,14,2023,UNICREDIT,Strategy & Technology,Hybrid Cloud & Data,"Application Migration and Modernization (not AWS, Microsoft)"
7621411,0063h00000K4sleAAB,0.0,0.0,0.0,200000.0,0.0,0.0,200000.0,200000.0,30869.0,30451.0,0.15434692,2023-02-11,1,4,2023,W,CQ,Design,Americas,US Distribution,US Cpg,Unassigned,Digital Squads,Taos Platform Eng Svcs (Manage) - Standalone,Platform Engineering Services,small,0,0,2023Q4W01,82223  Met with Kevin and working on Renewal to to get complete in Sept  and asked for a Vancouver CN PS Expand for 1 role,BREX INC.,2023-10-20,2023-09-25,PES-MS-Renewal - Brex: 2024 EUS Renewal,4,10,4,2023,Brex Inc.,Intelligent Operations,Application Operations,Cloud Platform Engineering Services
8158691,0063h00000LW8WUAA1,0.0,0.0,0.0,50000.0,0.0,0.0,50000.0,50000.0,1648.0,2666.0,0.0329753,2023-07-13,1,4,2023,W,CQ,Qualify,Rest of EMEA,NCEE,Netherlands,TARGET PREMIER,Select BPS-T,DTT: AI & Analytics - Talent (Red Hat),AI & Analytics,small,0,0,2023Q4W01,229 Senior CHRO meeting delayed to Sept 28 Decision on budget will be taken after this meeting,BOOKING.COM B.V.,2023-10-27,2023-09-22,Booking BPO - TOM Design,4,10,5,2023,BOOKING HOLDINGS,Strategy & Technology,Hybrid Cloud & Data,"AI Integration Services (with IBM, AWS, Microsoft)"
8242097,0063h00000LpiXBAAZ,0.0,0.0,100000.0,100000.0,100000.0,0.0,100000.0,100000.0,20964.0,34438.0,0.20964054,2023-09-12,1,4,2023,W,CQ,Propose,Americas,US Public and Communications,US Public and Communications,ENTERPRISE,Healthcare,CT: Acquisition Adobe Workfront (Rego Consulting),Adobe,small,0,0,2023Q4W01,Refine original proposal to submit to client week of 911,UNITED HEALTHCARE SERVICES INC,2023-10-27,2023-09-25,UHG Optum | WF | WF Tier 1 New Team Implementation,4,10,5,2023,UNITEDHEALTH GROUP,Strategy & Technology,Business Applications,Marketing Transformation
7621411,0063h00000K4sleAAB,21600.0,21600.0,0.0,21600.0,21600.0,21600.0,0.0,21600.0,0.0,0.0,0.0,2023-02-11,14,4,2023,W,PQ,Won,Americas,US Distribution,US Cpg,Unassigned,Digital Squads,Taos Platform Eng Svcs (Manage) - Standalone,Platform Engineering Services,small,0,0,2023Q4W14,12423  Received signed PCR for 1 mo extension,BREX INC.,2023-12-04,2023-12-05,PES-MS-Renewal - Brex: 2024 EUS Renewal,4,12,11,2023,Brex Inc.,Intelligent Operations,Application Operations,Cloud Platform Engineering Services
6863707,0063h00000HELXCAA5,0.0,0.0,0.0,0.0,0.0,0.0,0.0,800000.0,0.0,0.0,0.0,2022-01-06,14,4,2023,W,PQ,Lost,Rest of EMEA,NCEE,Defence and Government,Unassigned,Select BPS-T,App & Data Modrn for Distributed Apps-No Cloud with Red Hat,IBM & Red Hat,small,0,0,2023Q4W14,134 The next  meeting with IT director was postponed until cca 244 23 meeting with IT Director next week 261 MoFA assumes that it will call for tender in Q2,MINISTERSTVO ZAHRANICNICH VECI,2023-12-12,2023-06-28,System Integrator,4,12,12,2023,MOFA CZ,Strategy & Technology,Hybrid Cloud & Data,"Application Migration and Modernization (not AWS, Microsoft)"
8270948,0063h00000LvLS7AAN,0.0,0.0,80000.0,80000.0,80000.0,0.0,80000.0,80000.0,37318.0,73110.0,0.46647534,2023-09-22,1,4,2023,W,CQ,Propose,UKI,UKI Distribution,UKI CSI,ENTERPRISE,Select Build(ISV)/Service(GSI),HRTT: Multi-Process HR BPO,Talent Operations,small,0,0,2023Q4W01,Expansion of scope to include Pakistan,EY GLOBAL SERVICES LIMITED,2023-12-22,2023-10-06,EY Expansion - Pakistan - 1 year,4,12,13,2023,ERNST & YOUNG LLP,Intelligent Operations,Business Operations,HR and Employee Operations
8182821,0063h00000KgOTwAAN,614420.0,614420.0,0.0,614420.0,614420.0,614420.0,0.0,614420.0,597371.0,1382661.0,0.97225288,2023-05-25,1,4,2023,W,CQ,Won,APAC,ANZ,Australia COMM,PREMIER,Select BPS-T,DTT: AI & Analytics - Finance & Supply Chain,AI & Analytics,small,0,0,2023Q4W01,59 SoW to be submit for client review by 8th September 28092023 Expected signing on 280923,AUSNET ASSET SERVICES PTY LTD,2023-10-02,2023-10-03,Automated Reporting NMD - Phase 1,4,10,2,2023,AUSNET SERVICES,Strategy & Technology,Hybrid Cloud & Data,"AI Integration Services (with IBM, AWS, Microsoft)"
8246000,0063h00000Kd84qAAB,0.0,0.0,0.0,290000.0,0.0,0.0,290000.0,290000.0,19256.0,31794.0,0.0664006,2023-03-01,1,4,2023,W,CQ,Qualify,Americas,US Distribution,US Cpg,PREMIER,Consumer Products,ServiceNow - Implementation & Manage,ServiceNow,small,0,0,2023Q4W01,912 DH  Repurpsing this Opportunity for the efforts surrounding the VMS integration work  IBM C SNOW team is working with us on the sizing IBM CSS providing design oversight next client meeting on 914,MCKESSON CORP,2023-11-01,2023-09-18,VMS Integration with McK SNOW,4,11,6,2023,MCKESSON CORPORATION,Intelligent Operations,Application Operations,Cloud Platform Engineering Services
8102269,0063h00000LDTjXAAX,238095.0,0.0,0.0,238095.0,238095.0,238095.0,238095.0,238095.0,154493.0,232586.0,0.64887103,2023-07-22,1,4,2023,W,CQ,Negotiate,Japan,JP Industrial,JP Automotive,TARGET ENTERPRISE,Automotive,CT: Intelligent Marketing Transformation,Customer,small,0,0,2023Q4W01,,YAMAHA MOTOR CO. LTD.,2023-12-28,2023-08-03,C本部 Y-GK協業PJ支援(23年12月),4,12,14,2023,YAMAHA MOTOR,Strategy & Technology,Business Applications,Marketing Transformation
2243410,0063h00000I1XNfAAN,0.0,0.0,0.0,0.0,0.0,0.0,0.0,2000000.0,0.0,0.0,0.0,2022-03-15,1,4,2023,W,CQ,Lost,Americas,US Communications & Industrial,US Communications & Industrial,Unassigned,Select BPS-T,DTT: AI & Analytics - Finance & Supply Chain,AI & Analytics,small,0,0,2023Q4W01,understand scope from client,AECOM,2023-10-20,2023-03-09,AI / ML Rollout,4,10,4,2023,"AECOM MANAGEMENT SERVICES, INC.",Strategy & Technology,Hybrid Cloud & Data,"AI Integration Services (with IBM, AWS, Microsoft)"
8221959,0063h00000LBzWVAA1,0.0,0.0,0.0,250000.0,0.0,0.0,250000.0,250000.0,3150.0,5438.0,0.01260141,2023-06-05,1,4,2023,W,CQ,Design,Americas,US Public and Communications,US Public and Communications,ENTERPRISE,Education,"CT: Experience Design, Mobile & Spatial Computing",Enterprise Experience Design iX,small,0,0,2023Q4W01,925 Engaging in conversation with client around GenAI Strategy Pushign out Close because of budgetary constraints,UNIVERSITY OF CALIFORNIA SANTA CRUZ,2023-11-17,2023-09-25,AI Foundational Strategy & POC,4,11,8,2023,STATE OF CALIFORNIA,Strategy & Technology,Strategy & Transformation,Experience Strategy and Design
8120362,0063h00000LJhRpAAL,0.0,0.0,0.0,95238.0,0.0,0.0,95238.0,95238.0,0.0,0.0,0.0,2023-07-31,14,4,2023,W,PQ,Qualify,Japan,JP Distribution,JP Consumer,Unassigned,Digital Squads,FSCT: Procurement Transformation with SAP Ariba,SAP,small,0,0,2023Q4W14,,RICHEMONT F&A JAPAN LIMITED,2023-11-30,2023-07-31,不正検知ソリューション,4,11,10,2023,RICHEMONT F&A JAPAN LIMITED,Strategy & Technology,Business Applications,Enterprise SAP Transformation
7092382,0063h00000JP3r8AAD,0.0,0.0,0.0,0.0,0.0,0.0,0.0,450000.0,0.0,0.0,0.0,2022-08-01,14,4,2023,W,PQ,Lost,APAC,ASEAN,Singapore FSS wo DBS,Unassigned,Banking,Threat Mgmt Svcs (Custom C&SI) 6950-45H Withdrawn,Cyber Threat Management,small,0,0,2023Q4W14,client say to put on hold since they have implemented Palo Alto SOAR and would like to leverage on the tool to achieve automation,OVERSEA-CHINESE BANKING,2023-11-30,2023-08-08,OCBC L1-L2 SOC support,4,11,10,2023,OVERSEA-CHINESE BANKING CORPORATION (OCBC),Intelligent Operations,Cybersecurity,IBM Cyber Threat Management
8160619,0063h00000LYPAsAAP,9523.0,0.0,0.0,9523.0,0.0,0.0,9523.0,9523.0,3062.0,4609.0,0.32159654,2023-08-02,1,4,2023,W,CQ,Qualify,Japan,JP Distribution,JP Consumer,Unassigned,Select Technology Sales Rep,HRTT: Skills Transformation,Talent,small,0,0,2023Q4W01,,SECOM IS  HQ,2023-11-30,2023-09-11,新任事業所責任者研修実施支援　11月,4,11,10,2023,SECOM,Strategy & Technology,Strategy & Transformation,HR and Talent Transformation
8285750,0063h00000MGghmAAD,19563.0,19563.0,0.0,19563.0,19563.0,19563.0,0.0,19563.0,0.0,0.0,0.0,2023-09-28,14,4,2023,W,PQ,Won,Rest of EMEA,Italy,Italy FSS,Unassigned,Select BPS-T,Application Maintenance and Management - OnPrem,Custom Application Operations,small,0,0,2023Q4W14,,SELLA PERSONAL CREDIT,2023-11-02,2023-11-02,Sistemi Informativi - Rinnovo XF,4,11,6,2023,BANCA SELLA,Intelligent Operations,Application Operations,Custom Application Management Services
8079667,0063h00000KrzNbAAJ,0.0,0.0,577086.0,577086.0,577086.0,0.0,577086.0,577086.0,102804.0,169745.0,0.17814459,2023-06-27,1,4,2023,W,CQ,Propose,Americas,US Distribution,US Cpg,Unassigned,Select BPS-T,RISE with SAP,SAP Application Operations,small,0,0,2023Q4W01,922 so far they have not signed with Azure I will reach out to them after close of quarter and if they did not sign will get back and reconfigure the design,SAP AMERICA INC,2023-10-13,2023-09-28,SAP RISE Premium Supplier (Indiana Packers),4,10,3,2023,MITSUBISHI CORPORATION,Intelligent Operations,Application Operations,Application Management Services for SAP Applications
8560498,0063h00000MPDd6AAH,76057.0,76057.0,0.0,76057.0,76057.0,76057.0,0.0,76057.0,0.0,0.0,0.0,2023-12-10,14,4,2023,W,PQ,Won,Japan,JP Industrial,JP Automotive,TARGET ENTERPRISE,Automotive,CT: Service Transformation with Salesforce,Salesforce,small,0,0,2023Q4W14,,YAMAHA MOTOR CO. LTD.,2023-12-29,2024-01-05,ロイヤルティマネジメントシステム運用保守2024年,4,12,14,2023,YAMAHA MOTOR,Strategy & Technology,Business Applications,Enterprise Salesforce Transformation
8416358,0063h00000MOAkcAAH,8897.0,8897.0,0.0,8897.0,8897.0,8897.0,0.0,8897.0,0.0,0.0,0.0,2023-11-03,14,4,2023,W,PQ,Won,UKI,UKI Communications,UKI ENU (wo NG),Unassigned,Select BPS-T,DTT: Data Transformation - Customer,Data Services,small,0,0,2023Q4W14,Provide SOW for signing,CDP WORLDWIDE,2023-11-09,2023-11-28,Data Engineering Staff Aug (2nd extension),4,11,7,2023,CDP WORLDWIDE,Strategy & Technology,Hybrid Cloud & Data,"Data Transformation (with IBM, AWS, Microsoft)"
8267755,0063h00000LLS4SAAX,3000000.0,0.0,0.0,3000000.0,3000000.0,3000000.0,3000000.0,3000000.0,1760130.0,2030426.0,0.5867103,2023-09-21,1,4,2023,W,CQ,Closing,Americas,US Distribution,US TNT,TARGET PREMIER,Digital Squads,HRTT: Skills Transformation,Talent,large,0,0,2023Q4W01,GXO completes and returns all vendor questions and data requests by 227 Current status AWAITING,Gxo Logistics Supply Chain Inc.,2023-10-20,2023-10-02,GXO HR BPO,4,10,4,2023,GXO LOGISTICS INC,Strategy & Technology,Strategy & Transformation,HR and Talent Transformation
7955247,0063h00000KgUXNAA3,193668.0,193668.0,0.0,193668.0,193668.0,193668.0,0.0,193668.0,0.0,0.0,0.0,2023-05-26,14,4,2023,W,PQ,Won,Rest of EMEA,France,France FSS,ENTERPRISE,Banking,Application Maintenance and Management - OnPrem,Custom Application Operations,Unassigned,0,0,2023Q4W14,,BNP PARIBAS,2023-11-17,2023-11-17,PF West Coast : LLF Lot 1,4,11,8,2023,BNP PARIBAS,Intelligent Operations,Application Operations,Custom Application Management Services
8189968,0063h00000LuaEjAAJ,0.0,0.0,0.0,0.0,0.0,0.0,0.0,400000.0,0.0,0.0,0.0,2023-08-28,1,4,2023,W,CQ,Lost,Americas,LA,Brazil,Unassigned,Select BPS-T,AMS for SAP S/4HANA or S/4 Migration on Cloud,SAP Application Operations,small,0,0,2023Q4W01,,Lundin Mining - Chapada,2023-11-22,2023-09-18,AMS S4 - After Hypercare,4,11,9,2023,LUNDIN MINING - CHAPADA,Intelligent Operations,Application Operations,Application Management Services for SAP Applications
8311365,0063h00000MHbIJAA1,0.0,0.0,0.0,0.0,0.0,0.0,14056.0,14056.0,5335.0,0.0,0.3795984,2023-10-06,1,4,2023,W,CQ,Engage,Rest of EMEA,MEA,Turkiye,Unassigned,Digital Squads,Application Maintenance and Management - OnPrem,Custom Application Operations,small,0,0,2023Q4W01,,ABBOT LAB.ITH.IHR.TIC.LTD.STI.,2023-10-12,2023-10-06,PD-008205 - VAT Change 2023 - Turkey,4,10,3,2023,ABBOTT LABORATORIES,Intelligent Operations,Application Operations,Custom Application Management Services
8401119,0063h00000MGgy6AAD,0.0,0.0,0.0,0.0,0.0,0.0,0.0,80000.0,0.0,0.0,0.0,2023-09-28,14,4,2023,W,PQ,Lost,Rest of EMEA,France,France FSS,Unassigned,Digital Squads,Enterprise & Ecosystem Risk (C&SI) 6950-97B Withdrawn,Cyber Strategy & Risk,small,0,0,2023Q4W14,,MUTUELLE DE FRANCE,2023-12-31,2023-11-29,Cadrage projets sécurité,4,12,14,2023,MUTUELLE GENERALE DE PREVOYANCE,Intelligent Operations,Cybersecurity,IBM Cyber Strategy and Risk
8305088,0063h00000MHLjhAAH,0.0,0.0,0.0,77500.0,0.0,0.0,77500.0,77500.0,4860.0,9521.0,0.06271507,2023-10-04,1,4,2023,W,CQ,Design,UKI,UKI Financial Services Sector,UKI Lloyds,ENTERPRISE,Banking,DTT: Risk & Compliance Advisory,Promontory,small,0,0,2023Q4W01,,LLOYDS BANK PLC,2023-12-31,2023-10-04,PFG UK - (CODA) LBG IBS Review and Cloud Resilience,4,12,14,2023,LLOYDS BANKING GROUP,Strategy & Technology,Hybrid Cloud & Data,"AI Integration Services (with IBM, AWS, Microsoft)"
8092301,0063h00000KsnOrAAJ,1000000.0,0.0,0.0,1000000.0,1000000.0,0.0,1000000.0,1000000.0,180580.0,417966.0,0.18058071,2023-07-20,1,4,2023,W,CQ,Propose,APAC,ASEAN,Singapore PUB,TARGET ENTERPRISE,Select Technology Sales Rep,"CT: Experience Design, Mobile & Spatial Computing",Enterprise Experience Design iX,small,0,0,2023Q4W01,,DEFENCE SCIENCE & TECHNOLOGY,2023-12-15,2023-10-04,URMS,4,12,12,2023,DEFENCE SCIENCE AND TECHNOLOGY AGENCY,Strategy & Technology,Strategy & Transformation,Experience Strategy and Design
6878171,0063h00000IQB98AAH,0.0,0.0,0.0,0.0,0.0,0.0,0.0,0.0,0.0,0.0,0.0,2022-05-17,1,4,2023,W,CQ,Propose,Americas,US Public and Communications,US Public and Communications,ENTERPRISE,Government,CT: Service Transformation with Salesforce,Salesforce,small,0,0,2023Q4W01,101  LC License to Hunt only   No new update from Holly  Parson Engineering who Primed Last email from Holly Klotz  Parsons was late Summer,LOS ANGELES WORLD AIRPORT,2023-12-29,2023-10-03,LAWA MSA with Parsons,4,12,14,2023,STATE OF CALIFORNIA,Strategy & Technology,Business Applications,Enterprise Salesforce Transformation
7879514,0063h00000L0Eg5AAF,0.0,0.0,77500.0,77500.0,77500.0,0.0,77500.0,77500.0,2628.0,5148.0,0.03391687,2023-05-02,1,4,2023,W,CQ,Propose,UKI,UKI Distribution,UKI CPG,TARGET ENTERPRISE,Select BPS-T,DTT: AI & Analytics - Customer,AI & Analytics,small,0,0,2023Q4W01,510  Meeting with client and space and people to determine next steps 6th Oct,DIAGEO GREAT BRITAIN LIMITED,2023-12-14,2023-10-04,Diageo - Data -pop up analytics,4,12,12,2023,DIAGEO GRAND MET,Strategy & Technology,Hybrid Cloud & Data,"AI Integration Services (with IBM, AWS, Microsoft)"
638406,0063h00000EksjPAAR,0.0,0.0,0.0,0.0,0.0,0.0,40000.0,40000.0,403.0,0.0,0.0100993,2021-03-15,1,4,2023,W,CQ,Engage,Americas,US Federal,US Federal,ENTERPRISE,Government,US Federal - Cyber & Biometrics Services Withdrawn,Migration & Modernization,small,0,0,2023Q4W01,,US DEPT OF COMMERCE,2023-10-31,2023-08-29,DOC NOAA - Grants Online Information Technology Support Services,4,10,6,2023,CIV - COMMERCE - NIST,Strategy & Technology,Hybrid Cloud & Data,Digital Product Design and Engineering
7713191,0063h00000K0ABhAAN,0.0,0.0,0.0,0.0,0.0,0.0,0.0,2000000.0,0.0,0.0,0.0,2022-12-15,14,4,2023,W,PQ,Lost,Americas,LA,Mexico,Unassigned,Select Client,App & Data modernization for Distributed Apps,Migration & Modernization,small,0,0,2023Q4W14,The workshop with Temenos has been concluded There is an event in Austria from Temenos with representation of IBM Spain Consulting Team We will be coordinating the estrategy to position our approach for Multiva,BANCO MULTIVA S. A. INSTITUCION DEB,2023-10-10,2023-09-12,Puesta a punto Corebanking upgrade Multiva-TemenosT24,4,10,3,2023,MULTIVA,Strategy & Technology,Hybrid Cloud & Data,"Application Migration and Modernization (not AWS, Microsoft)"
8107949,0063h00000LWrknAAD,0.0,0.0,0.0,0.0,0.0,0.0,0.0,160800.0,0.0,0.0,0.0,2023-07-19,14,4,2023,W,PQ,Lost,Rest of EMEA,SPGI,Spain FSS,TARGET PREMIER,Insurance,"OnPrem Application Development, DevOps & Hybrid Integration",Migration & Modernization,small,0,0,2023Q4W14,,MUTUA MADRILEÑA,2023-12-15,2023-12-11,Taller de Prestaciones. MVP,4,12,12,2023,MUTUA MADRILENA AUTOMOVILISTA SOCIEDAD DE SEGUROS A PRIMA FIJA,Strategy & Technology,Hybrid Cloud & Data,Digital Product Design and Engineering
7064161,0063h00000I0g7LAAR,0.0,0.0,0.0,0.0,0.0,0.0,0.0,13155000.0,0.0,0.0,0.0,2022-02-23,14,4,2023,W,PQ,Lost,Americas,LA,LA A and U,Unassigned,Select Client,"CT: Experience Design, Mobile & Spatial Computing",Enterprise Experience Design iX,large,0,0,2023Q4W14,6 weeks Garage for building a solution and BC,DIRECTV ARGENTINA S.R.L.,2023-12-29,2023-11-30,Integral Customer Care (Argentina),4,12,14,2023,WERTHEIN GROUP,Strategy & Technology,Strategy & Transformation,Experience Strategy and Design
8315677,0063h00000MHtdeAAD,53178.0,53178.0,0.0,53178.0,53178.0,53178.0,0.0,53178.0,0.0,0.0,0.0,2023-10-09,14,4,2023,W,PQ,Won,Rest of EMEA,DACH,Switzerland,ENTERPRISE,Consumer Products,CSS: Data and AI Security Svcs (Mgd) 6950-23O Withdrawn,CyberDefend,small,0,0,2023Q4W14,,Philip Morris Products S.A.,2023-11-13,2023-11-13,PMI App Sec Services for B2B Applications,4,11,8,2023,PHILIP MORRIS INTERNATIONAL,Intelligent Operations,Cybersecurity,IBM CyberDefend
8212462,0063h00000Luoa3AAB,6072.0,6072.0,0.0,6072.0,6072.0,6072.0,0.0,6072.0,0.0,0.0,0.0,2023-09-04,14,4,2023,W,PQ,Won,Americas,LA,Brazil,PREMIER,Select BPS-T,Application Maintenance and Management - OnPrem,Custom Application Operations,small,0,0,2023Q4W14,,MAPFRE SEGUROS GERAIS S.A.,2023-10-06,2023-10-06,Aumento dígitos válidos campo de dados bancários Tronweb,4,10,2,2023,MAPFRE,Intelligent Operations,Application Operations,Custom Application Management Services
7601912,0063h00000JaQXjAAN,0.0,0.0,0.0,0.0,0.0,0.0,0.0,10000000.0,0.0,0.0,0.0,2022-11-02,14,4,2023,W,PQ,Lost,Americas,US Communications & Industrial,US Communications & Industrial,Unassigned,Select BPS-T,"FSCT: Supply Chain, Proc & Sustainability BPO",Finance & Procurement BPO,large,0,0,2023Q4W14,Submit RFI on Nov 16 2022,SONOCO PRODUCTS CO,2023-12-15,2023-09-19,Sonoco (GBS-Full Scope BPO),4,12,12,2023,SONOCO PRODUCTS COMPANY,Intelligent Operations,Business Operations,Procurement Operations
8418474,0063h00000LoysKAAR,0.0,0.0,0.0,0.0,0.0,0.0,0.0,74400.0,0.0,0.0,0.0,2023-09-06,14,4,2023,W,PQ,Lost,APAC,ANZ,Australia PUB,Unassigned,Select BPS-T,CSS: Sec Svcs for Cloud (C&SI) (cloud) 6950-41E Withdrawn,CyberDefend,small,0,0,2023Q4W14,1611 Uni decided to buy direct vendor PS of Fortinet no room for IBM to participate,UNIVERSITY OF SYDNEY,2023-11-16,2023-11-16,Cyber: Fortinet TAM Staff Aug,4,11,8,2023,UNIVERSITY OF SYDNEY,Intelligent Operations,Cybersecurity,IBM CyberDefend
