SK_LINE_ITEM,OPPORTUNITY_ID,CALL_AMT,WON_AMT,UPSIDE_AMT,QUALIFY_PLUS_AMT,PROPOSE_PLUS_AMT,NEGOTIATE_PLUS_AMT,OPEN_PIPELINE_AMT,OPPORTUNITY_VALUE,PPA_AMT,PPV_AMT,PWP_PROB,CREATED_DATE,WEEK,QUARTER,YEAR,SNAPSHOT_LEVEL,RELATIVE_QUARTER_MNEUMONIC,SALES_STAGE,GEOGRAPHY,MARKET,SECTOR,ACCOUNT_TYPE,INDUSTRY,UT30_NAME,PRACTICE,DEAL_SIZE,IBM_GEN_AI_IND,PARTNER_GEN_AI_IND,SALES_WEEK_DESCRIPTION,NEXT_STEP,ACCOUNT_NAME,CLOSE_DATE,LAST_MODIFIED_DATE,OPPORTUNITY_NAME,CLOSE_QUARTER,CLOSE_MONTH,CLOSE_WEEK,CLOSE_YEAR,CLIENT_NAME,UT15_NAME,UT17_NAME,UT20_NAME
8438746,0063h00000K1W93AAF,207411.0,207411.0,0.0,207411.0,207411.0,207411.0,0.0,207411.0,0.0,0.0,0.0,2022-11-15,14,4,2023,W,PQ,Won,Rest of EMEA,SPGI,Spain COMM,ENTERPRISE,Energy & Utilities,"FSCT: Supply Chain, Proc & Sustainability BPO",Finance & Procurement BPO,small,0,0,2023Q4W14,,NATURGY ENERGY GROUP SA,2023-11-10,2023-11-20,LCorp - COLA'23 Variable charges Q3,4,11,7,2023,NATURGY,Intelligent Operations,Business Operations,Procurement Operations
8062828,0063h00000LCz73AAD,1106497.0,0.0,0.0,1106497.0,1106497.0,1106497.0,1106497.0,1106497.0,165891.0,312171.0,0.14992482,2023-07-06,1,4,2023,W,CQ,Negotiate,Rest of EMEA,DACH,DE FSS,PREMIER,Insurance,App & Data Migration Services with Red Hat,IBM & Red Hat,small,0,0,2023Q4W01,Transmitt PCR to client,ITERGO Service GmbH,2023-12-05,2023-10-04,ITERGO MLK CR-Paket 2023 COLA,4,12,11,2023,ERGO GROUP,Strategy & Technology,Hybrid Cloud & Data,"Application Migration and Modernization (not AWS, Microsoft)"
7422013,0063h00000JyKZAAA3,0.0,0.0,0.0,0.0,0.0,0.0,0.0,250000.0,0.0,0.0,0.0,2022-11-21,1,4,2023,W,CQ,Lost,Americas,US Communications & Industrial,US Communications & Industrial,ENTERPRISE,Telecommunications,App & Data modernization for Distributed Apps,Migration & Modernization,small,0,0,2023Q4W01,060323 Org changes resulted in scope being moved to new leadership New leadership is absorbing IBM proposition and expected to give direction in March Proposal value remains at 5Mn,A T & T SERVICES INC,2023-10-27,2023-10-02,AT&T ServinceNow Order enrichment and Order processing,4,10,5,2023,AT&T,Strategy & Technology,Hybrid Cloud & Data,"Application Migration and Modernization (not AWS, Microsoft)"
8217246,0063h00000LurHLAAZ,0.0,0.0,0.0,0.0,0.0,0.0,0.0,3000000.0,0.0,0.0,0.0,2023-09-06,1,4,2023,W,CQ,Lost,Rest of EMEA,DACH,DE COMM DIST HLS,Unassigned,Unassigned,Cloud Native App Development,Migration & Modernization,small,0,0,2023Q4W01,,Paulaner Brauerei Gruppe GmbH & Co.,2023-11-30,2023-09-11,Paulaner I Cloud,4,11,10,2023,SCHÖRGHUBER STIFTUNG & CO. HOLDING KG,Strategy & Technology,Hybrid Cloud & Data,Digital Product Design and Engineering
8273810,0063h00000MGJBBAA5,0.0,0.0,0.0,0.0,0.0,0.0,0.0,130000.0,0.0,0.0,0.0,2023-09-25,14,4,2023,W,PQ,Lost,Rest of EMEA,DACH,DE FSS,TARGET PREMIER,Select Technology Sales Rep,DTT: AI & Analytics - Customer,AI & Analytics,small,0,0,2023Q4W14,,Debeka Krankenversicherungs-Verein,2023-11-15,2023-10-10,2.Verlängerung Pilotverarbeitung,4,11,8,2023,DEBEKA KRANKENVERSICH,Strategy & Technology,Hybrid Cloud & Data,"AI Integration Services (with IBM, AWS, Microsoft)"
8188617,0063h00000KrBqoAAF,0.0,0.0,840000.0,840000.0,840000.0,0.0,840000.0,840000.0,47533.0,111846.0,0.05658729,2023-06-05,1,4,2023,W,CQ,Propose,Rest of EMEA,SPGI,Spain FSS,ENTERPRISE,Banking,"OnPrem App Dev, DevOps & Hybrid Integration with Red Hat",IBM & Red Hat,small,0,0,2023Q4W01,,SANTANDER GLOBAL TECHNOLOGY,2023-12-29,2023-09-27,One Stop shop – RC – L1.3 Motores y Metodología,4,12,14,2023,GRUPO SANTANDER,Strategy & Technology,Hybrid Cloud & Data,Digital Product Design and Engineering
8032154,0063h00000LQAfdAAH,0.0,0.0,0.0,0.0,0.0,0.0,0.0,1500000.0,0.0,0.0,0.0,2023-06-29,14,4,2023,W,PQ,Lost,Rest of EMEA,DACH,DE IND,FOUNDATION CLUSTER,Digital Squads,AMS for SAP S/4HANA or S/4 Migration on No-Cloud,SAP Application Operations,small,0,0,2023Q4W14,,ELANTAS GmbH,2023-12-19,2023-10-23,SAP Develpment and Support,4,12,13,2023,SKION GMBH,Intelligent Operations,Application Operations,Application Management Services for SAP Applications
7471820,0063h00000K05DrAAJ,0.0,0.0,0.0,0.0,0.0,0.0,0.0,124000.0,0.0,0.0,0.0,2022-12-15,1,4,2023,W,CQ,Lost,APAC,ANZ,Australia IND,PREMIER,Select BPS-T,"CT: Experience Design, Mobile & Spatial Computing",Enterprise Experience Design iX,small,0,0,2023Q4W01,213  Alignment meeting with Remona on best way forward to be scheduled,TECHNOLOGICAL RESOURCES PTY,2023-10-06,2023-07-31,RT Mobility CoC Phase 1 ext,4,10,2,2023,RIO TINTO,Strategy & Technology,Strategy & Transformation,Experience Strategy and Design
8451451,0063h00000LLnv2AAD,418200.0,418200.0,0.0,418200.0,418200.0,418200.0,0.0,418200.0,0.0,0.0,0.0,2023-10-06,14,4,2023,W,PQ,Won,Americas,US Financial,US Financial,FOUNDATION,Finance Markets,FSCT: Enterprise Transformation with Oracle,Oracle,small,0,0,2023Q4W14,1117  Scope finalized SOW in progress,THE DEPOSITORY TRUST & CLEARING,2023-12-26,2023-12-26,Oracle ERP and Treasury,4,12,14,2023,DEPOSITORY TRUST & CLEARING,Strategy & Technology,Business Applications,Enterprise Oracle Transformation
7022365,0063h00000Iur5IAAR,1000000.0,0.0,0.0,1000000.0,1000000.0,0.0,1000000.0,1000000.0,0.0,0.0,0.0,2022-07-06,14,4,2023,W,PQ,Propose,Rest of EMEA,SPGI,Greece,PREMIER,Select Technology Sales Rep,"OnPrem App Dev, DevOps & Hybrid Integration with Red Hat",IBM & Red Hat,small,0,0,2023Q4W14,,NATIONAL BANK OF GREECE,2023-12-31,2023-09-28,Additional functionality for CBS Stream 1,4,12,14,2023,NAT.BANK OF GREECE SA,Strategy & Technology,Hybrid Cloud & Data,Digital Product Design and Engineering
7422013,0063h00000JyKZAAA3,0.0,0.0,0.0,0.0,0.0,0.0,0.0,250000.0,0.0,0.0,0.0,2022-11-21,14,4,2023,W,PQ,Lost,Americas,US Communications & Industrial,US Communications & Industrial,ENTERPRISE,Telecommunications,App & Data modernization for Distributed Apps,Migration & Modernization,small,0,0,2023Q4W14,060323 Org changes resulted in scope being moved to new leadership New leadership is absorbing IBM proposition and expected to give direction in March Proposal value remains at 5Mn,A T & T SERVICES INC,2023-10-27,2023-10-02,AT&T ServinceNow Order enrichment and Order processing,4,10,5,2023,AT&T,Strategy & Technology,Hybrid Cloud & Data,"Application Migration and Modernization (not AWS, Microsoft)"
7566562,0063h00000K40FjAAJ,0.0,0.0,0.0,0.0,0.0,0.0,0.0,465600.0,0.0,0.0,0.0,2023-01-25,14,4,2023,W,PQ,Lost,Unassigned,Unassigned,Unassigned,Unassigned,Select BPS-T,Taos Platform Eng Svcs (Manage) - Standalone,Platform Engineering Services,small,0,0,2023Q4W14,,Oportun Financial,2023-11-07,2023-08-24,Taos - MS Renewal - Oportun EUS,4,11,7,2023,OPORTUN FINANCIAL CORPORATION,Intelligent Operations,Application Operations,Cloud Platform Engineering Services
8048469,0063h00000KsCWUAA3,57142.0,0.0,0.0,57142.0,0.0,0.0,57142.0,57142.0,0.0,0.0,0.0,2023-07-04,14,4,2023,W,PQ,Qualify,Japan,JP Distribution,JP Consumer,FOUNDATION CLUSTER,Select BPS-T,CT: Intelligent Service Transformation,Customer,small,0,0,2023Q4W14,,T.HASEGAWA CO. LTD.,2023-10-31,2023-10-12,先行テーマ　2023年10月～3月,4,10,6,2023,"T. HASEGAWA CO., LTD",Intelligent Operations,Business Operations,Customer Service Transformation and Operations
7606180,0063h00000KYgHdAAL,33000.0,33000.0,0.0,33000.0,33000.0,33000.0,0.0,33000.0,0.0,0.0,0.0,2023-02-05,14,4,2023,W,PQ,Won,Rest of EMEA,DACH,DE IND,ENTERPRISE,Automotive,Cloud Native App Development,Migration & Modernization,small,0,0,2023Q4W14,,Mercedes-Benz Group AG,2023-11-29,2023-11-29,MB AS Transf. 2024 -#16-XCCC-r,4,11,10,2023,DAIMLER MERCEDES-BENZ,Strategy & Technology,Hybrid Cloud & Data,Digital Product Design and Engineering
7471820,0063h00000K05DrAAJ,0.0,0.0,0.0,0.0,0.0,0.0,0.0,124000.0,0.0,0.0,0.0,2022-12-15,14,4,2023,W,PQ,Lost,APAC,ANZ,Australia IND,PREMIER,Select BPS-T,"CT: Experience Design, Mobile & Spatial Computing",Enterprise Experience Design iX,small,0,0,2023Q4W14,213  Alignment meeting with Remona on best way forward to be scheduled,TECHNOLOGICAL RESOURCES PTY,2023-10-06,2023-07-31,RT Mobility CoC Phase 1 ext,4,10,2,2023,RIO TINTO,Strategy & Technology,Strategy & Transformation,Experience Strategy and Design
8419568,0063h00000MBjfMAAT,76129.0,76129.0,0.0,76129.0,76129.0,76129.0,0.0,76129.0,0.0,0.0,0.0,2023-11-06,14,4,2023,W,PQ,Won,APAC,ISA,ISA IND,Unassigned,Digital Squads,AMS for ECC or Any SAP Legacy Solutions on No-Cloud,SAP Application Operations,small,0,0,2023Q4W14,,GABRIEL INDIA LTD,2023-12-27,2024-01-03,SAP AMS,4,12,14,2023,ANAND NISHIKAWA COMPANY LIMITED,Intelligent Operations,Application Operations,Application Management Services for SAP Applications
7561085,0063h00000KT9oQAAT,0.0,0.0,0.0,476190.0,0.0,0.0,476190.0,476190.0,90632.0,144632.0,0.19032842,2023-01-24,1,4,2023,W,CQ,Design,Japan,JP Banking & Financial Markets,JP BKFM Other,PREMIER,Select Technology Sales Rep,Application Maintenance and Management - Cloud,Custom Application Operations,small,0,0,2023Q4W01,,NORIN CHUO KINKO AKISI,2023-11-30,2023-02-22,API基盤 全体PM/PMO,4,11,10,2023,THE NORINCHUKIN BANK,Intelligent Operations,Application Operations,Custom Application Management Services
8341310,0063h00000MIEbHAAX,3297.0,3297.0,0.0,3297.0,3297.0,3297.0,0.0,3297.0,0.0,0.0,0.0,2023-10-12,14,4,2023,W,PQ,Won,APAC,ASEAN,Singapore IND,Unassigned,Select BPS-T,FSCT: Payables BPO,Finance & Procurement BPO,small,0,0,2023Q4W14,,RIO TINTO SINGAPORE HOLDINGS,2023-11-29,2023-12-04,Additional scope of Closing & Reporting and Reconciliation work for Entity 9056,4,11,10,2023,RIO TINTO,Intelligent Operations,Business Operations,Procurement Operations
8142055,0063h00000LNjQfAAL,0.0,0.0,0.0,0.0,0.0,0.0,0.0,80000.0,0.0,0.0,0.0,2023-06-08,14,4,2023,W,PQ,Lost,Americas,US Distribution,US TNT,ENTERPRISE,Travel & Transportation,Cloud native App Dev & Hybrid Integration with Red Hat,IBM & Red Hat,small,0,0,2023Q4W14,2 Onshore  JavaJ2EE  Rest WebService and Spring Boot   812023 thru 12292023,UNITED PARCEL SERVICE OASIS SUPPLY,2023-10-27,2023-08-16,DCT - UPS-REQ-0018537 - WEB SHIPPING-MDROA830106,4,10,5,2023,UPS,Strategy & Technology,Hybrid Cloud & Data,Digital Product Design and Engineering
8277713,0063h00000MGR2SAAX,0.0,0.0,0.0,0.0,0.0,0.0,0.0,5150000.0,0.0,0.0,0.0,2023-09-26,14,4,2023,W,PQ,Lost,Americas,US Communications & Industrial,US Communications & Industrial,ENTERPRISE,Automotive,Cloud Native App Development,Migration & Modernization,small,0,0,2023Q4W14,Respond to RFP,HONDA NORTH AMERICA SERVICES LLC,2023-11-29,2023-10-13,Honda - Payment Platform SI,4,11,10,2023,HONDA MOTOR,Strategy & Technology,Hybrid Cloud & Data,Digital Product Design and Engineering
8117925,0063h00000LXvYOAA1,0.0,0.0,0.0,0.0,0.0,0.0,0.0,120000.0,0.0,0.0,0.0,2023-07-28,14,4,2023,W,PQ,Lost,Americas,US Communications & Industrial,US Communications & Industrial,TARGET ENTERPRISE,Select BPS-T,CT: Intelligent Sales Transformation,Customer,small,0,0,2023Q4W14,,INTERNATIONAL MOTORS LLC,2023-10-13,2023-08-18,Order to Delivery Experience Journey Mapping,4,10,3,2023,VOLKSWAGEN,Strategy & Technology,Strategy & Transformation,Sales and Commerce Transformation
8082397,0063h00000LPLcNAAX,0.0,0.0,0.0,0.0,0.0,0.0,0.0,0.0,0.0,0.0,0.0,2023-06-22,1,4,2023,W,CQ,Lost,Americas,Canada,Canada COMM,Unassigned,Digital Squads,HRTT: Enterprise Change Management,Talent,small,0,0,2023Q4W01,,INDEPENDENT SYSTEM OPERATOR,2023-10-12,2023-09-11,Modern Data Management,4,10,3,2023,ALBERTA ELECTRIC SYSTEM OPERATOR,Strategy & Technology,Strategy & Transformation,HR and Talent Transformation
2071574,0063h00000GRkIhAAL,0.0,0.0,0.0,0.0,0.0,0.0,0.0,400000.0,0.0,0.0,0.0,2021-09-02,1,4,2023,W,CQ,Lost,Rest of EMEA,France,France IND,ENTERPRISE,Automotive,Cyber Strategy&Resiliency (C&SI) (cloud) 6950-97G Withdrawn,Cyber Strategy & Risk,small,0,0,2023Q4W01,Qualify w Netskope and versus new CISOs ORG,PEUGEOT CITROEN AUTOMOBILE SA,2023-11-28,2023-09-18,SASE @ PSA,4,11,10,2023,STELLANTIS-CNH-IVECO,Intelligent Operations,Cybersecurity,IBM Cyber Strategy and Risk
7919497,0063h00000L0k1ZAAR,958319.0,958319.0,0.0,958319.0,958319.0,958319.0,0.0,958319.0,0.0,0.0,0.0,2023-05-09,14,4,2023,W,PQ,Won,Rest of EMEA,NCEE,Denmark,Unassigned,Select BPS-T,AMS for Any Oracle Solutions on No-Cloud,Oracle Application Operations,small,0,0,2023Q4W14,,REGION SJÆLLAND,2023-11-23,2023-12-29,KMD extension,4,11,9,2023,REGION SJÆLLAND,Intelligent Operations,Application Operations,Application Management Services for Oracle
8145007,0063h00000LJy6yAAD,41595.0,41595.0,0.0,41595.0,41595.0,41595.0,0.0,41595.0,0.0,0.0,0.0,2023-08-04,14,4,2023,W,PQ,Won,Americas,Canada,Canada DIST,Unassigned,Computer Integrated Systems Design,Application Maintenance and Management - OnPrem,Custom Application Operations,small,0,0,2023Q4W14,,KYNDRYL CANADA LIMITED,2023-10-11,2023-10-19,RFS 857- RITM0081113- Plan and execute short term remediation for LDAP environment,4,10,3,2023,KYNDRYL,Intelligent Operations,Application Operations,Custom Application Management Services
7747155,0063h00000KxXooAAF,0.0,0.0,0.0,0.0,0.0,0.0,0.0,42750.0,0.0,0.0,0.0,2023-03-21,1,4,2023,W,CQ,Lost,Rest of EMEA,SPGI,Spain COMM,TARGET ENTERPRISE,Select BPS-T,DTT: Microsoft Business Applications - Customer,Microsoft,small,0,0,2023Q4W01,,ORANGE ESPAGNE SA,2023-12-30,2023-10-03,VN: Totem formacion y varios CRs,4,12,14,2023,ORANGE,Strategy & Technology,Hybrid Cloud & Data,"AI Integration Services (with IBM, AWS, Microsoft)"
7984730,0063h00000KrKYeAAN,0.0,0.0,155000.0,155000.0,155000.0,155000.0,155000.0,155000.0,12114.0,23732.0,0.0781604,2023-06-08,1,4,2023,W,CQ,Negotiate,UKI,UKI Distribution,UKI Retail,Unassigned,Digital Squads,CT: Service Transformation with Salesforce,Salesforce,small,0,0,2023Q4W01,Working with client on service cloud optimisation scope which this is included  scoping concludes beginning of October,WREN KITCHENS LIMITED,2023-11-30,2023-09-18,Wren - Salesforce Experience Cloud,4,11,10,2023,VIDA CAPITAL PARTNERS LIMITED,Strategy & Technology,Business Applications,Enterprise Salesforce Transformation
8002094,0063h00000LCLj7AAH,0.0,0.0,0.0,1116000.0,0.0,0.0,1116000.0,1116000.0,138927.0,302673.0,0.12448686,2023-06-16,1,4,2023,W,CQ,Qualify,APAC,ANZ,Australia DIST,Unassigned,Select BPS-T,App & Data Migration Services,Migration & Modernization,small,0,0,2023Q4W01,028 Need to redo SRRPRR process require someone else from Service line to drive this as OO Value is 500k1800k AUD,MICROSOFT PTY LIMITED,2023-10-20,2023-08-02,Migration subK Service Catalog item proposal,4,10,4,2023,MICROSOFT CORPORATION,Strategy & Technology,Hybrid Cloud & Data,"Application Migration and Modernization (not AWS, Microsoft)"
2057989,0063h00000HDjcbAAD,0.0,0.0,0.0,0.0,0.0,0.0,0.0,238095.0,0.0,0.0,0.0,2021-12-17,14,4,2023,W,PQ,Lost,Japan,JP Industrial,JP AD CP and IPR,FOUNDATION,Industrial Products,FSCT: Asset Management & Optimization,Supply Chain,small,0,0,2023Q4W14,,JFE STEEL OUTSOURCI SO,2023-12-22,2023-09-29,RBM保全最適化システム　熱延工程（スケジューラー展開＠福山）,4,12,13,2023,JFE HOLDINGS CORPORATION,Strategy & Technology,Strategy & Transformation,Supply Chain Transformation
7777776,0063h00000L1xQ0AAJ,0.0,0.0,0.0,0.0,0.0,0.0,0.0,10900.0,0.0,0.0,0.0,2023-03-23,14,4,2023,W,PQ,Lost,Americas,LA,Brazil,ENTERPRISE,Select BPS-T,AMS for ECC or Any SAP Legacy Solutions on No-Cloud,SAP Application Operations,small,0,0,2023Q4W14,PCR negotiation with contract rates  ARC,MOTO HONDA DA AMAZONIA LTDA,2023-12-31,2023-12-22,HSA:ARC RITM0445844 - A ALTERAÇAO NO PROCESSO DEVERÁ GARANTIR O REGISTRO DE TODAS AS NOTAS NOS SISTEMA LEGADOS.,4,12,14,2023,HONDA MOTOR,Intelligent Operations,Application Operations,Application Management Services for SAP Applications
7922325,0063h00000KfwjLAAR,0.0,0.0,0.0,0.0,0.0,0.0,0.0,0.0,0.0,0.0,0.0,2023-05-12,1,4,2023,W,CQ,Qualify,Rest of EMEA,France,France FSS,ENTERPRISE,Banking,App & Data Migration Services,Migration & Modernization,Unassigned,0,0,2023Q4W01,waiting decision of customer on scope,CREDIT AGRICOLE-GROUP INFRASTR,2023-10-06,2023-07-10,(NOVERE CONSULTING) CAGIP Migration Db2 Phase 3,4,10,2,2023,CREDIT AGRICOLE,Strategy & Technology,Hybrid Cloud & Data,"Application Migration and Modernization (not AWS, Microsoft)"
8379275,0063h00000MBOUHAA5,3528.0,3528.0,0.0,3528.0,3528.0,3528.0,0.0,3528.0,0.0,0.0,0.0,2023-10-24,14,4,2023,W,PQ,Won,Japan,JP Insurance,JP INS SOMPO,ENTERPRISE,Insurance,Cloud Native App Development,Migration & Modernization,small,0,0,2023Q4W14,,NIPPON F&M SYSTEM,2023-10-31,2023-10-31,次期ＯＬ実行基盤　営業店内勤端末リプレイス対応　２０２３年１１月,4,10,6,2023,SOMPO HOLDINGS,Strategy & Technology,Hybrid Cloud & Data,Digital Product Design and Engineering
7894763,0063h00000L0Q6ZAAV,0.0,0.0,0.0,0.0,0.0,0.0,0.0,150000.0,0.0,0.0,0.0,2023-05-04,14,4,2023,W,PQ,Lost,Americas,US Communications & Industrial,US Communications & Industrial,Unassigned,Select Client,"Enterprise Cloud Strategy, Arch & Oper Model Transformation",Cloud Advisory,small,0,0,2023Q4W14,,Semiconductor Components Industries LLC.,2023-11-23,2023-10-12,OnSemi - CMS design,4,11,9,2023,SEMICONDUCTOR COMPONENTS INDUSTRIES LLC,Strategy & Technology,Hybrid Cloud & Data,Cloud and Technology Strategy
2471516,0063h00000I27gwAAB,0.0,0.0,100000.0,100000.0,100000.0,0.0,100000.0,100000.0,3748.0,6734.0,0.03748656,2022-03-31,1,4,2023,W,CQ,Propose,Rest of EMEA,NCEE,CEE,Unassigned,Select BPS-T,NordCloud Hyperscaler Advisory & Build Services - Standalone,Migration & Modernization,small,0,0,2023Q4W01,2nd Oct call with CSOB sponsor in the week of 9th Oct,CESKOSLOVENSKA OBCHODNI,2023-11-24,2023-10-02,Cloudification roadmap,4,11,9,2023,KBC GROUP N.V.,Strategy & Technology,Hybrid Cloud & Data,Digital Product Design and Engineering
7475146,0063h00000JBxSaAAL,0.0,0.0,0.0,0.0,0.0,0.0,0.0,101201.0,0.0,0.0,0.0,2022-11-11,14,4,2023,W,PQ,Lost,Americas,Canada,Canada Fin,PREMIER,Digital Squads,DTT: AI & Analytics - Customer,AI & Analytics,small,0,0,2023Q4W14,13 Nov  Present PCR to GISA this week,GENERAL INSURANCE STATISTICAL,2023-11-01,2023-07-24,GISA PCR 10 - Catastrophe Management,4,11,6,2023,GENERAL INSURANCE STATISTICAL AGENCY,Strategy & Technology,Hybrid Cloud & Data,"AI Integration Services (with IBM, AWS, Microsoft)"
8251130,0063h00000LYgmNAAT,0.0,0.0,0.0,50000.0,0.0,0.0,50000.0,50000.0,923.0,1947.0,0.01846973,2023-08-04,1,4,2023,W,CQ,Qualify,Rest of EMEA,SPGI,Spain COMM,ENTERPRISE,Telecommunications,DTT: AI & Analytics - Talent (Red Hat),AI & Analytics,small,0,0,2023Q4W01,,TELEFONICA DE ESPAÑA S.A.U,2023-12-24,2023-09-27,WatsonX Talent Telefonica,4,12,13,2023,TELEFONICA,Strategy & Technology,Hybrid Cloud & Data,"AI Integration Services (with IBM, AWS, Microsoft)"
7716304,0063h00000KBabkAAD,0.0,0.0,0.0,0.0,0.0,0.0,0.0,200000.0,0.0,0.0,0.0,2023-01-31,14,4,2023,W,PQ,Lost,Rest of EMEA,DACH,DE COMM DIST HLS,FOUNDATION CLUSTER,Select BPS-T,FSCT: Enterprise Transformation with SAP S/4HANA,SAP,small,0,0,2023Q4W14,,BAHAG Baus Handelsgesellschaft AG,2023-11-16,2023-08-31,Bauhaus I S/4HANA DACH Phase II A (Finance),4,11,8,2023,BAHAG BAUS HANDELSGES,Strategy & Technology,Business Applications,Enterprise SAP Transformation
7894763,0063h00000L0Q6ZAAV,0.0,0.0,0.0,0.0,0.0,0.0,150000.0,150000.0,5506.0,0.0,0.03670988,2023-05-04,1,4,2023,W,CQ,Engage,Americas,US Communications & Industrial,US Communications & Industrial,Unassigned,Select Client,"Enterprise Cloud Strategy, Arch & Oper Model Transformation",Cloud Advisory,small,0,0,2023Q4W01,,Semiconductor Components Industries LLC.,2023-11-23,2023-05-04,OnSemi - CMS design,4,11,9,2023,SEMICONDUCTOR COMPONENTS INDUSTRIES LLC,Strategy & Technology,Hybrid Cloud & Data,Cloud and Technology Strategy
7777776,0063h00000L1xQ0AAJ,0.0,0.0,10900.0,10900.0,10900.0,10900.0,10900.0,10900.0,1559.0,2959.0,0.14302995,2023-03-23,1,4,2023,W,CQ,Negotiate,Americas,LA,Brazil,ENTERPRISE,Select BPS-T,AMS for ECC or Any SAP Legacy Solutions on No-Cloud,SAP Application Operations,small,0,0,2023Q4W01,PCR negotiation with contract rates  ARC,MOTO HONDA DA AMAZONIA LTDA,2023-11-30,2023-10-04,HSA:ARC RITM0445844 - A ALTERAÇAO NO PROCESSO DEVERÁ GARANTIR O REGISTRO DE TODAS AS NOTAS NOS SISTEMA LEGADOS.,4,11,10,2023,HONDA MOTOR,Intelligent Operations,Application Operations,Application Management Services for SAP Applications
8289210,0063h00000KTuUhAAL,0.0,0.0,476190.0,476190.0,476190.0,476190.0,476190.0,476190.0,106668.0,160586.0,0.22400357,2023-01-31,1,4,2023,W,CQ,Negotiate,Japan,JP Insurance,JP INS Other,TARGET PREMIER,Insurance,DTT: AI & Analytics - Customer,AI & Analytics,small,0,0,2023Q4W01,PIPoC,MEIJIYASUDA LIFESYS SO,2023-12-29,2023-09-29,PI活用PoC,4,12,14,2023,MEIJI YASUDA LIFE INSURANCE,Strategy & Technology,Hybrid Cloud & Data,"AI Integration Services (with IBM, AWS, Microsoft)"
8237518,0063h00000LLApSAAX,39300.0,0.0,0.0,39300.0,39300.0,39300.0,39300.0,39300.0,31163.0,69254.0,0.79295563,2023-09-11,1,4,2023,W,CQ,Closing,Rest of EMEA,Italy,Italy GOV HLTH,PREMIER,Select BPS-T,AMS for ECC or Any SAP Legacy Solutions on No-Cloud,SAP Application Operations,small,0,0,2023Q4W01,,A.MENARINI,2023-10-27,2023-09-19,SAP GS - 2 EM packages (Add. 5),4,10,5,2023,A.MENARINI IND.CHIM.FARM.RIUN.SRL,Intelligent Operations,Application Operations,Application Management Services for SAP Applications
7934630,0063h00000KvDHHAA3,0.0,0.0,0.0,0.0,0.0,0.0,0.0,300000.0,0.0,0.0,0.0,2023-05-18,14,4,2023,W,PQ,Lost,Americas,US Communications & Industrial,US Communications & Industrial,TARGET ENTERPRISE,Energy & Utilities,Application Maintenance and Management - OnPrem,Custom Application Operations,small,0,0,2023Q4W14,,AMERICAN ELECTRIC POWER SERVICE CORP,2023-11-10,2023-10-02,AEP-ADMS Display Build & Integration PCR1,4,11,7,2023,AMERICAN ELECTRIC POWER,Intelligent Operations,Application Operations,Custom Application Management Services
7912216,0063h00000LBS7PAAX,0.0,0.0,0.0,0.0,0.0,0.0,0.0,0.0,0.0,0.0,0.0,2023-05-08,1,4,2023,W,CQ,Qualify,Americas,LA,Mexico,Unassigned,Select BPS-T,Secure DevOps Services (C&SI) (cloud) 6950-28J Withdrawn,CyberDefend,small,0,0,2023Q4W01,August 25th 2023 Client has shared that IBM was not qualified as one of the top providers for the CyberSecurity Office Projects Iberdrola has IBM will attempt to improve prices and share them as unsolicited,IBERDROLA SERVICIOS,2023-10-31,2023-08-25,Iberdrola - MX - Global Security Framework Agreement,4,10,6,2023,IBERDROLA,Intelligent Operations,Cybersecurity,IBM CyberDefend
7554791,0063h00000KSQPrAAP,1171971.0,1171971.0,0.0,1171971.0,1171971.0,1171971.0,0.0,1171971.0,0.0,0.0,0.0,2023-01-19,14,4,2023,W,PQ,Won,Americas,Canada,Canada Quebec,TARGET PREMIER,Select Client,"OnPrem Application Development, DevOps & Hybrid Integration",Migration & Modernization,small,0,0,2023Q4W14,Q4 2023 ROD,INDUSTRIELLE ALLIANCE,2023-12-29,2024-01-03,Q4 December 2023 ROD bucket for multiple clients,4,12,14,2023,INDUSTRIELLE ALLIANCE,Strategy & Technology,Hybrid Cloud & Data,Digital Product Design and Engineering
7370304,0063h00000K0qcYAAR,0.0,0.0,0.0,0.0,0.0,0.0,0.0,50000.0,0.0,0.0,0.0,2022-10-31,14,4,2023,W,PQ,Lost,Americas,US Financial,US Financial,Unassigned,Select Technology Sales Rep,Threat Mgmt Svcs (Custom C&SI) (cloud) 6950-36D Withdrawn,Cyber Threat Management,small,0,0,2023Q4W14,,UMB BANK NA,2023-11-30,2023-09-15,UMB - Threat Feed,4,11,10,2023,UMB BANK,Intelligent Operations,Cybersecurity,IBM Cyber Threat Management
7966264,0063h00000L0vYvAAJ,0.0,0.0,0.0,1000000.0,0.0,0.0,1000000.0,1000000.0,87752.0,143005.0,0.08775291,2023-05-11,1,4,2023,W,CQ,Qualify,Rest of EMEA,DACH,Switzerland,FOUNDATION CLUSTER,Government,FSCT: Enterprise Transformation with SAP S/4HANA,SAP,small,0,0,2023Q4W01,,Bundesamt für Informatik und,2023-11-30,2023-09-15,BIT SAP Systembetrieb (23061)_Call-off Lot:2 MDG,4,11,10,2023,SCHWEIZERISCHE EIDGENOSSCHENSCHAFT - BUND,Strategy & Technology,Business Applications,Enterprise SAP Transformation
7039134,0063h00000Iv9PcAAJ,0.0,0.0,0.0,0.0,0.0,0.0,0.0,1.0,0.0,0.0,0.0,2022-07-14,14,4,2023,W,PQ,Lost,Americas,US Communications & Industrial,US Communications & Industrial,Unassigned,Select Build(ISV)/Service(GSI),Taos Platform Eng Svcs (Manage) - Standalone,Platform Engineering Services,small,0,0,2023Q4W14,,ShipXpress LLC,2023-12-31,2023-10-09,PES-PS-Cld Catalog - Navis Prospecting,4,12,14,2023,NAVIS LLC,Intelligent Operations,Application Operations,Cloud Platform Engineering Services
8306716,0063h00000MHMvJAAX,-490820.0,-490820.0,0.0,-490820.0,-490820.0,-490820.0,0.0,-490820.0,0.0,0.0,0.0,2023-10-04,14,4,2023,W,PQ,Won,Americas,US Communications & Industrial,US Communications & Industrial,FOUNDATION,Select Build(ISV)/Service(GSI),AMS for ECC or Any SAP Legacy Solutions on No-Cloud,SAP Application Operations,small,0,0,2023Q4W14,,ROCKWELL AUTOMATION INC,2023-11-06,2023-11-09,Annual Vol Discount Signing True-up (FY23),4,11,7,2023,"ROCKWELL AUTOMATION, INC.",Intelligent Operations,Application Operations,Application Management Services for SAP Applications
8498636,0063h00000MYn1pAAD,89400.0,89400.0,0.0,89400.0,89400.0,89400.0,0.0,89400.0,0.0,0.0,0.0,2023-12-05,14,4,2023,W,PQ,Won,Japan,JP Banking & Financial Markets,JP BKFM MUFG,ENTERPRISE,Banking,Application Maintenance and Management - OnPrem,Custom Application Operations,small,0,0,2023Q4W14,,ASIKAGA BK,2023-12-29,2023-12-29,足利 全銀コア対応,4,12,14,2023,MITSUBISHI UFJ FINANCIAL GROUP (MUFG),Intelligent Operations,Application Operations,Custom Application Management Services
8151986,0063h00000LZ911AAD,0.0,0.0,0.0,2000000.0,0.0,0.0,2000000.0,2000000.0,185307.0,182797.0,0.09265372,2023-08-08,1,4,2023,W,CQ,Design,Americas,US Communications & Industrial,US Communications & Industrial,ENTERPRISE,Select Build(ISV)/Service(GSI),AMS for Any Oracle Solutions on Cloud,Oracle Application Operations,small,0,0,2023Q4W01,Aug 11 Pending Partner application assessment,EY GLOBAL SERVICES LTD,2023-12-15,2023-08-23,ITT - OM PCR ### - Partner App - On-Going Support,4,12,12,2023,ERNST & YOUNG LLP,Intelligent Operations,Application Operations,Application Management Services for Oracle
