SK_LINE_ITEM,OPPORTUNITY_ID,CALL_AMT,WON_AMT,UPSIDE_AMT,QUALIFY_PLUS_AMT,PROPOSE_PLUS_AMT,NEGOTIATE_PLUS_AMT,OPEN_PIPELINE_AMT,OPPORTUNITY_VALUE,PPA_AMT,PPV_AMT,PWP_PROB,CREATED_DATE,WEEK,QUARTER,YEAR,SNAPSHOT_LEVEL,RELATIVE_QUARTER_MNEUMONIC,SALES_STAGE,GEOGRAPHY,MARKET,SECTOR,ACCOUNT_TYPE,INDUSTRY,UT30_NAME,PRACTICE,DEAL_SIZE,IBM_GEN_AI_IND,PARTNER_GEN_AI_IND,SALES_WEEK_DESCRIPTION,NEXT_STEP,ACCOUNT_NAME,CLOSE_DATE,LAST_MODIFIED_DATE,OPPORTUNITY_NAME,CLOSE_QUARTER,CLOSE_MONTH,CLOSE_WEEK,CLOSE_YEAR,CLIENT_NAME,UT15_NAME,UT17_NAME,UT20_NAME
7978978,0063h00000LNUp5AAH,0.0,0.0,0.0,0.0,0.0,0.0,0.0,2000000.0,0.0,0.0,0.0,2023-06-06,1,4,2023,W,CQ,Lost,Americas,US Public and Communications,US Public and Communications,ENTERPRISE,Healthcare,DTT: AI & Analytics - Talent,AI & Analytics,small,0,0,2023Q4W01,,UNITED HEALTHCARE SERVICES INC,2023-11-30,2023-08-28,Provider Directory Pilot,4,11,10,2023,UNITEDHEALTH GROUP,Strategy & Technology,Hybrid Cloud & Data,"AI Integration Services (with IBM, AWS, Microsoft)"
7677566,0063h00000KCbcFAAT,0.0,0.0,0.0,0.0,0.0,0.0,0.0,3333333.0,0.0,0.0,0.0,2023-02-27,1,4,2023,W,CQ,Lost,Americas,Canada,Canada PUB,ENTERPRISE,Government,FSCT: Enterprise Transformation with SAP S/4HANA,SAP,small,0,0,2023Q4W01,March 16 Teaming with EYlead and responding to the RFSQ for March 17 next step is SI down selection by end of March for the RFP,PLEXXUS,2023-11-24,2023-04-20,"Plexxus, SAP Modernization and Managed Services RFSQ",4,11,9,2023,ONTARIO HEALTH,Strategy & Technology,Business Applications,Enterprise SAP Transformation
7581117,0063h00000K4LE5AAN,0.0,0.0,0.0,0.0,0.0,0.0,0.0,120000.0,0.0,0.0,0.0,2023-02-01,14,4,2023,W,PQ,Lost,Rest of EMEA,NCEE,SweNo,PREMIER,Select BPS-T,FSCT: Enterprise Transformation with SAP S/4HANA,SAP,small,0,0,2023Q4W14,We have responded to multiple roles Waiting for interview feedback on one candidate,HUSQVARNA AB,2023-11-15,2023-10-17,Consulting Consolidation - CV 5,4,11,8,2023,HUSQVARNA AB,Strategy & Technology,Business Applications,Enterprise SAP Transformation
8000254,0063h00000LALYKAA5,0.0,0.0,0.0,186000.0,0.0,0.0,186000.0,186000.0,4829.0,11177.0,0.02596375,2023-04-13,1,4,2023,W,CQ,Design,APAC,ANZ,Australia PUB,Unassigned,Select BPS-T,CT: Customer Transformation with Adobe,Adobe,small,0,0,2023Q4W01,27 Sept   Richa to reach out and follow up with client,UNIVERSITY OF SYDNEY C/O,2023-11-16,2023-09-27,Adobe Solutions Lead = Project One,4,11,8,2023,UNIVERSITY OF SYDNEY,Strategy & Technology,Business Applications,Marketing Transformation
7677566,0063h00000KCbcFAAT,0.0,0.0,0.0,0.0,0.0,0.0,0.0,3333333.0,0.0,0.0,0.0,2023-02-27,14,4,2023,W,PQ,Lost,Americas,Canada,Canada PUB,ENTERPRISE,Government,FSCT: Enterprise Transformation with SAP S/4HANA,SAP,small,0,0,2023Q4W14,March 16 Teaming with EYlead and responding to the RFSQ for March 17 next step is SI down selection by end of March for the RFP,PLEXXUS,2023-11-24,2023-04-20,"Plexxus, SAP Modernization and Managed Services RFSQ",4,11,9,2023,ONTARIO HEALTH,Strategy & Technology,Business Applications,Enterprise SAP Transformation
7542477,0063h00000KQo69AAD,0.0,0.0,0.0,0.0,0.0,0.0,0.0,2000000.0,0.0,0.0,0.0,2023-01-03,14,4,2023,W,PQ,Lost,Americas,Canada,Canada Fin,PREMIER,Select Client,App & Data Modernization for Distributed Apps - No Cloud,Migration & Modernization,small,0,0,2023Q4W14,1 Deadline for Clarification Questions if any Friday Jan 19th   2 Deadline for RFI Response Submission Monday February 6th,CREDIT UNION CENTRAL ALBERTA,2023-12-29,2023-08-17,PPJV/Optimus RFI/Stride CU - Managed Services + Core Banking,4,12,14,2023,CREDIT UNION CENTRAL ALBERTA,Strategy & Technology,Hybrid Cloud & Data,"Application Migration and Modernization (not AWS, Microsoft)"
7899066,0063h00000L0SRKAA3,0.0,0.0,0.0,0.0,0.0,0.0,0.0,217000.0,0.0,0.0,0.0,2023-05-05,14,4,2023,W,PQ,Lost,APAC,ANZ,Australia IND,Unassigned,Select BPS-T,FSCT: Enterprise Transformation with SAP S/4HANA,SAP,small,0,0,2023Q4W14,JB 0609  Marking as lost as the single PM role has gone to Infosys,BP AUSTRALIA PTY LIMITED,2023-11-17,2023-09-06,BP P1 SAP AU Operating Model - Manage,4,11,8,2023,BP PLC,Strategy & Technology,Business Applications,Enterprise SAP Transformation
8186226,0063h00000Lnb0vAAB,51428.0,0.0,0.0,51428.0,51428.0,0.0,51428.0,51428.0,29183.0,43934.0,0.56745263,2023-08-25,1,4,2023,W,CQ,Propose,Japan,JP Insurance,JP INS Other,TARGET PREMIER,Insurance,DTT: AI & Analytics - Customer,AI & Analytics,small,0,0,2023Q4W01,,MITSUI SUMITOMO INSURANCE COMPANY,2023-12-29,2023-10-06,PM・アーキテクト部ご支援（２０２４年１−３月）,4,12,14,2023,MS&AD INSURANCE GROUP,Strategy & Technology,Hybrid Cloud & Data,"AI Integration Services (with IBM, AWS, Microsoft)"
8259531,0063h00000LLOSwAAP,0.0,0.0,0.0,1000.0,0.0,0.0,1000.0,1000.0,450.0,449.0,0.45040429,2023-09-19,1,4,2023,W,CQ,Design,Americas,US Communications & Industrial,US Communications & Industrial,ENTERPRISE,Select Build(ISV)/Service(GSI),FSCT: Enterprise Transformation with SAP ECC,SAP,small,0,0,2023Q4W01,,EY GLOBAL SERVICES LTD,2023-10-20,2023-10-01,ITT - MS PCR 174 after backlog Signing $3.0M; Net Rev $3.95M EY eBilling Resources Nov to Jun,4,10,4,2023,ERNST & YOUNG LLP,Strategy & Technology,Business Applications,Enterprise SAP Transformation
8113168,0063h00000LJaflAAD,31067.0,31067.0,0.0,31067.0,31067.0,31067.0,0.0,31067.0,0.0,0.0,0.0,2023-07-26,14,4,2023,W,PQ,Won,Americas,LA,Brazil,ENTERPRISE,Banking,App & Data modernization for Distributed Apps with Red Hat,IBM & Red Hat,small,0,0,2023Q4W14,IBMArielCrestani IBMVictorRibeiro BradescoAlexandra BradescoCristinaPinna,BANCO BRADESCO S/A,2023-11-10,2023-11-24,[Bradesco] - Alocação Arquiteto Consulting - Quantum Safe,4,11,7,2023,BANCO BRADESCO,Strategy & Technology,Hybrid Cloud & Data,"Application Migration and Modernization (not AWS, Microsoft)"
8104953,0063h00000LXQz1AAH,0.0,0.0,0.0,0.0,0.0,0.0,38750.0,38750.0,1416.0,0.0,0.03656434,2023-07-24,1,4,2023,W,CQ,Engage,UKI,UKI Industrial,UKI ELE IPR CNP (wo BP),PREMIER,Select BPS-T,DTT: Risk & Compliance Advisory,Promontory,small,0,0,2023Q4W01,,PREMIER FARNELL UK LTD,2023-10-29,2023-07-24,PFG UK - Data Privacy Advisory,4,10,5,2023,AVNET INC,Strategy & Technology,Hybrid Cloud & Data,"AI Integration Services (with IBM, AWS, Microsoft)"
7947343,0063h00000KvMiOAAV,0.0,0.0,0.0,0.0,0.0,0.0,0.0,209523.0,0.0,0.0,0.0,2023-05-23,14,4,2023,W,PQ,Lost,Japan,JP Banking & Financial Markets,JP BKFM MUFG,ENTERPRISE,Banking,Cloud native App Dev & Hybrid Integration with Red Hat,IBM & Red Hat,small,0,0,2023Q4W14,,114 B/K,2023-12-29,2023-09-01,【Chance Next】法人インバンOTP取引認証高度化,4,12,14,2023,MITSUBISHI UFJ FINANCIAL GROUP (MUFG),Strategy & Technology,Hybrid Cloud & Data,Digital Product Design and Engineering
8347720,0063h00000LLCXlAAP,0.0,0.0,0.0,0.0,0.0,0.0,0.0,28571.0,0.0,0.0,0.0,2023-09-12,14,4,2023,W,PQ,Lost,Japan,JP Industrial,JP Automotive,PREMIER,Automotive,Sentaca DevOps Migrate & Modern w RH - Standalone Withdrawn,IBM & Red Hat,small,0,0,2023Q4W14,,ISUZU MOTORS LIMITED,2023-10-31,2023-10-16,基幹刷新 原価会計 10月,4,10,6,2023,ISUZU MOTORS LIMITED,Strategy & Technology,Hybrid Cloud & Data,"Application Migration and Modernization (not AWS, Microsoft)"
8245421,0063h00000Lpox4AAB,0.0,0.0,0.0,30000000.0,0.0,0.0,30000000.0,30000000.0,1769922.0,2992481.0,0.05899742,2023-09-13,1,4,2023,W,CQ,Qualify,Americas,US Federal,US Federal,ENTERPRISE,Government,HRTT: HR Transformation with SAP SuccessFactors,SAP,large,0,0,2023Q4W01,Align with Mike Chon and SAP SuccessFactors to determine a SI strategy,US POSTAL SERVICE,2023-12-29,2023-09-13,SAP SuccessFactors Payroll,4,12,14,2023,CIV - UNITED STATE POSTAL SERVICE (USPS),Strategy & Technology,Business Applications,HR Technology
8472300,0063h00000MXrJ0AAL,0.0,0.0,278107.0,278107.0,278107.0,0.0,278107.0,278107.0,0.0,0.0,0.0,2023-11-24,14,4,2023,W,PQ,Propose,Rest of EMEA,DACH,Switzerland,TARGET PREMIER,Industrial Products,CT: Service Transformation with Salesforce,Salesforce,small,0,0,2023Q4W14,,ABB Information Systems Ltd,2023-12-31,2023-11-27,New integrations of local systems with SFDC CR 5180,4,12,14,2023,ABB,Strategy & Technology,Business Applications,Enterprise Salesforce Transformation
8418323,0063h00000KAyH1AAL,302385.0,302385.0,0.0,302385.0,302385.0,302385.0,0.0,302385.0,0.0,0.0,0.0,2023-01-13,14,4,2023,W,PQ,Won,Rest of EMEA,France,France DIST,Unassigned,Digital Squads,Enterprise IAM (C&SI) (cloud) 6950-29W Withdrawn,CyberDefend,small,0,0,2023Q4W14,,FINANCIERE B&B HOTELS,2023-11-10,2023-11-10,IAM Okta - SSO/MFA deployment & Life cycle mgt,4,11,7,2023,CASPER TOPCO,Intelligent Operations,Cybersecurity,IBM CyberDefend
7094968,0063h00000I0e7oAAB,0.0,0.0,0.0,0.0,0.0,0.0,0.0,300000.0,0.0,0.0,0.0,2022-02-23,1,4,2023,W,CQ,Lost,Rest of EMEA,NCEE,Netherlands,FOUNDATION,Select BPS-T,Hybrid Integration using Mulesoft,IBM & Red Hat,small,0,0,2023Q4W01,CTO Engaged Next steps to be discussed with Head Of CRM  Engage with CRM Stakeholders Validated by Aegon pre asr to be validated by asr,Aegon Levensverzekering NV,2023-10-31,2023-08-13,Customer Transformation- SalesForce,4,10,6,2023,AEGON INC,Strategy & Technology,Hybrid Cloud & Data,Hybrid Integration Services
8222180,0063h00000LJhgaAAD,395359.0,395359.0,0.0,395359.0,395359.0,395359.0,0.0,395359.0,0.0,0.0,0.0,2023-07-31,14,4,2023,W,PQ,Won,Rest of EMEA,SPGI,Portugal,Unassigned,Select BPS-T,"FSCT: Supply Chain, Proc & Mfg Transformation",Supply Chain,small,0,0,2023Q4W14,,CELBI S.A.,2023-12-22,2023-12-22,Altri -- Manutenção Maximo 2024-2026,4,12,13,2023,"ALTRI, S.G.P.S., S.A.",Strategy & Technology,Strategy & Transformation,Supply Chain Transformation
7985966,0063h00000LC3jWAAT,0.0,0.0,500000.0,500000.0,500000.0,0.0,500000.0,500000.0,14825.0,34883.0,0.02965116,2023-06-07,1,4,2023,W,CQ,Propose,Rest of EMEA,SPGI,Portugal,ENTERPRISE,Select BPS-T,App & Data modernization for Distributed Apps,Migration & Modernization,small,0,0,2023Q4W01,proposal presentation,SANTANDER TOTTA S.A.,2023-11-30,2023-09-11,One Stop Shop RFP C.J.PT Cards Avales,4,11,10,2023,GRUPO SANTANDER,Strategy & Technology,Hybrid Cloud & Data,"Application Migration and Modernization (not AWS, Microsoft)"
8253450,0063h00000LLIlIAAX,2800000.0,2800000.0,0.0,2800000.0,2800000.0,2800000.0,0.0,2800000.0,0.0,0.0,0.0,2023-09-15,14,4,2023,W,PQ,Won,Rest of EMEA,DACH,DE Other,Unassigned,Unassigned,Nordcloud Hyperscaler Mod & Migration Services - Standalone,Migration & Modernization,small,0,0,2023Q4W14,,DACH Agencies,2023-12-31,2023-12-31,ACQ Dummy NORDCLOUD Dec,4,12,14,2023,DACH GGMBH,Strategy & Technology,Hybrid Cloud & Data,"Application Migration and Modernization (not AWS, Microsoft)"
8171849,0063h00000JCTLkAAP,991132.0,0.0,0.0,991132.0,991132.0,991132.0,991132.0,991132.0,266868.0,451204.0,0.269256,2022-07-21,1,4,2023,W,CQ,Negotiate,Americas,US Public and Communications,US Public and Communications,ENTERPRISE,Government,DTT: Data Transformation - Customer (Red Hat),Data Services,large,0,0,2023Q4W01,,DEPT OF INFORMATION TECHNOLO GY &,2023-11-30,2023-10-06,NYC OTI (DoITT) - L3 Only M&O & Work Completed,4,11,10,2023,STATE OF NEW YORK,Strategy & Technology,Hybrid Cloud & Data,"Data Transformation (with IBM, AWS, Microsoft)"
8186839,0063h00000LmexfAAB,0.0,0.0,0.0,0.0,0.0,0.0,0.0,0.0,0.0,0.0,0.0,2023-08-16,14,4,2023,W,PQ,Lost,Americas,US Federal,US Federal,ENTERPRISE,Government,US Federal - Application Maintenance and Management - OnPrem,Custom Application Operations,small,0,0,2023Q4W14,,US RAILROAD RETIREMENT BOARD,2023-12-29,2023-09-11,Operations & Maintenance (O&M) Services for PPMS Application Enhancement Project (AEP) (TORFP No. F20101_SS_21_T00008),4,12,14,2023,CIV - TRANSPORTATION,Intelligent Operations,Application Operations,Custom Application Management Services
8444952,0063h00000IekLWAAZ,17142.0,17142.0,0.0,17142.0,17142.0,17142.0,0.0,17142.0,0.0,0.0,0.0,2022-10-25,14,4,2023,W,PQ,Won,Japan,JP Banking & Financial Markets,JP BKFM Other,FOUNDATION,Finance Markets,Application Maintenance and Management - OnPrem,Custom Application Operations,small,0,0,2023Q4W14,,DAIWA INSTITUTE OF RESEARCH LTD.,2023-12-21,2023-12-22,マイナンバー対応　IPコンポーネント保守（外販）,4,12,13,2023,DAIWA SECURITIES GROUP INC.,Intelligent Operations,Application Operations,Custom Application Management Services
8400026,0063h00000MBXQNAA5,677485.0,677485.0,0.0,677485.0,677485.0,677485.0,0.0,677485.0,0.0,0.0,0.0,2023-10-29,14,4,2023,W,PQ,Won,Rest of EMEA,NCEE,SweNo,Unassigned,Select BPS-T,Application Maintenance and Management - OnPrem,Custom Application Operations,small,0,0,2023Q4W14,20231212 Proposal sent to client,ARCHER NORGE AS,2023-12-18,2023-12-18,Project Manager Applications,4,12,13,2023,ARCHER LIMITED,Intelligent Operations,Application Operations,Custom Application Management Services
8082415,0063h00000LW99AAAT,0.0,0.0,0.0,0.0,0.0,0.0,0.0,0.0,0.0,0.0,0.0,2023-07-13,1,4,2023,W,CQ,Design,Americas,US Public and Communications,US Public and Communications,FOUNDATION,Government,AMS for Any Oracle Solutions on Cloud,Oracle Application Operations,small,0,0,2023Q4W01,,STATE OF TEXAS,2023-12-29,2023-09-12,Texas - HED - UTSystems - Rate Card for PeopleSoft AMS (Contract Vehicle),4,12,14,2023,STATE OF TEXAS,Intelligent Operations,Application Operations,Application Management Services for Oracle
8044415,0063h00000KsBCPAA3,0.0,0.0,0.0,0.0,0.0,0.0,0.0,450000.0,0.0,0.0,0.0,2023-07-03,14,4,2023,W,PQ,Lost,APAC,GCG,Hong Kong,FOUNDATION,Select BPS-T,DTT: Data Transformation - Customer,Data Services,small,0,0,2023Q4W14,,MTR CORPORATION LIMITED,2023-12-29,2023-12-12,MTRC - EAM Project Management Advisory,4,12,14,2023,MTR CORPORATION,Strategy & Technology,Hybrid Cloud & Data,"Data Transformation (with IBM, AWS, Microsoft)"
8200042,0063h00000Lo7gaAAB,0.0,0.0,0.0,0.0,0.0,0.0,0.0,2640000.0,0.0,0.0,0.0,2023-08-29,14,4,2023,W,PQ,Lost,Americas,US Communications & Industrial,US Communications & Industrial,TARGET PREMIER,Select Technology Sales Rep,Application Maintenance and Management - Cloud,Custom Application Operations,small,0,0,2023Q4W14,Workshop,DELUXE CORPORATION,2023-12-15,2023-12-12,Deluxe - Strategic Partnership Agreement,4,12,12,2023,DELUXE CORPORATION,Intelligent Operations,Application Operations,Custom Application Management Services
8081108,0063h00000LDElAAAX,0.0,0.0,0.0,0.0,0.0,0.0,1000000.0,1000000.0,9018.0,0.0,0.0090184,2023-07-14,1,4,2023,W,CQ,Engage,Americas,US Distribution,US Cpg,ENTERPRISE,Consumer Products,FSCT: Sustainability for Supply Chains & Proc Withdrawn,Enterprise Strategy,small,0,0,2023Q4W01,,Cencora Inc.,2023-11-30,2023-10-06,ABC Transportation Emissions Entire Network,4,11,10,2023,"CENCORA, INC",Strategy & Technology,Strategy & Transformation,Supply Chain Transformation
2062861,0063h00000HDs7aAAD,0.0,0.0,0.0,500000.0,0.0,0.0,500000.0,500000.0,7467.0,16594.0,0.01493542,2021-12-21,1,4,2023,W,CQ,Design,Rest of EMEA,Italy,Italy Commercial,FOUNDATION,Travel & Transportation,Application Maintenance and Management - Cloud,Custom Application Operations,small,0,0,2023Q4W01,,MOVYON S.P.A.,2023-12-22,2023-09-25,Estensione Framework Agreement,4,12,13,2023,AUTOSTRADE PER LITALIA,Intelligent Operations,Application Operations,Custom Application Management Services
8064064,0063h00000LVISwAAP,0.0,0.0,0.0,0.0,0.0,0.0,0.0,250000.0,0.0,0.0,0.0,2023-07-06,14,4,2023,W,PQ,Lost,Americas,US Financial,US Financial,ENTERPRISE,Banking,CT: Digital Product Engineering,Customer,small,0,0,2023Q4W14,,AMERICAN EXPRESS TRAVEL,2023-12-29,2023-10-17,Phase 1 Personalization,4,12,14,2023,AMERICAN EXPRESS,Strategy & Technology,Hybrid Cloud & Data,Digital Product Design and Engineering
8236175,0063h00000LYYqeAAH,100000.0,0.0,0.0,100000.0,100000.0,100000.0,100000.0,100000.0,37851.0,74154.0,0.37851064,2023-08-03,1,4,2023,W,CQ,Closing,UKI,UKI Financial Services Sector,UKI Banking Other,ENTERPRISE,Select BPS-T,DTT: Extreme Automation - Finance & Supply Chain,Industry Operations & Automation,small,0,0,2023Q4W01,0310  Initiated discussions with DVMO on renewals,DEUTSCHE BANK AG LONDON,2023-12-15,2023-10-06,Smartdoc APAC CTB Extension 2024,4,12,12,2023,DEUTSCHE BANK,Intelligent Operations,Business Operations,Industry Operations
7987104,0063h00000LNnT3AAL,1059000.0,0.0,0.0,1059000.0,0.0,0.0,1059000.0,1059000.0,365398.0,687601.0,0.34504066,2023-06-09,1,4,2023,W,CQ,Design,Rest of EMEA,DACH,DE IND,ENTERPRISE,Automotive,Cloud Native App Development,Migration & Modernization,small,0,0,2023Q4W01,Indentifier Katharina Ziegler,Mercedes-Benz Group AG,2023-12-15,2023-07-21,DT Truck XENTRY Portal 2024,4,12,12,2023,DAIMLER MERCEDES-BENZ,Strategy & Technology,Hybrid Cloud & Data,Digital Product Design and Engineering
8196290,0063h00000LoD7OAAV,50000.0,50000.0,0.0,50000.0,50000.0,50000.0,0.0,50000.0,0.0,0.0,0.0,2023-08-30,14,4,2023,W,PQ,Won,Rest of EMEA,NCEE,Bel Lux,PREMIER,Select BPS-T,AMS for Salesforce,ISV Application Operations,small,0,0,2023Q4W14,,UCB BIOPHARMA SRL,2023-12-12,2023-12-12,Veeva projects Q4-23,4,12,12,2023,UCB,Intelligent Operations,Application Operations,"Application Management Services for ISVs (not SAP, Oracle)"
8302519,0063h00000MHILcAAP,185219.0,185219.0,0.0,185219.0,185219.0,185219.0,0.0,185219.0,0.0,0.0,0.0,2023-10-04,14,4,2023,W,PQ,Won,Japan,JP Banking & Financial Markets,JP BKFM SMFG,ENTERPRISE,Banking,App & Data modernization for Distributed Apps with Red Hat,IBM & Red Hat,small,0,0,2023Q4W14,,JRI BANK SYSTEM 1,2023-10-30,2023-11-02,【NOCTOPUS-Lite】OS保守切れに伴うシステム廃止対応,4,10,6,2023,SUMITOMO MITSUI FINANCIAL GROUP,Strategy & Technology,Hybrid Cloud & Data,"Application Migration and Modernization (not AWS, Microsoft)"
8044415,0063h00000KsBCPAA3,0.0,0.0,450000.0,450000.0,450000.0,0.0,450000.0,450000.0,42995.0,94304.0,0.09554469,2023-07-03,1,4,2023,W,CQ,Propose,APAC,GCG,Hong Kong,FOUNDATION,Select BPS-T,DTT: Data Transformation - Customer,Data Services,small,0,0,2023Q4W01,,MTR CORPORATION LIMITED,2023-11-10,2023-09-20,MTRC - EAM Project Management Advisory,4,11,7,2023,MTR CORPORATION,Strategy & Technology,Hybrid Cloud & Data,"Data Transformation (with IBM, AWS, Microsoft)"
8002183,0063h00000KrawnAAB,0.0,0.0,0.0,0.0,0.0,0.0,0.0,47619.0,0.0,0.0,0.0,2023-06-16,14,4,2023,W,PQ,Lost,Japan,JP Communications,JP EEU,ENTERPRISE,Energy & Utilities,DTT: AI & Analytics - Finance & Supply Chain,AI & Analytics,small,0,0,2023Q4W14,,CHUGOKU ELECTRIC POWER,2023-12-22,2023-11-29,原子力 AI文書検索PoC,4,12,13,2023,CHUGOKU ELECTRIC POWER,Strategy & Technology,Hybrid Cloud & Data,"AI Integration Services (with IBM, AWS, Microsoft)"
8193614,0063h00000LAw51AAD,0.0,0.0,0.0,0.0,0.0,0.0,100000.0,100000.0,659.0,0.0,0.00659086,2023-04-25,1,4,2023,W,CQ,Engage,Rest of EMEA,MEA,Southern Africa,Unassigned,Select Client,DTT: Extreme Automation - Finance & Supply Chain,Industry Operations & Automation,small,0,0,2023Q4W01,6 Sep Session held with team on 5 Sep IBM Team to have next session with team to show IBM Capability 2109  Awaiting date from client for next meeting,Sasol,2023-11-30,2023-09-21,Process harmonization – Celonis,4,11,10,2023,SASOL LTD,Intelligent Operations,Business Operations,Industry Operations
7453985,0063h00000JxxNUAAZ,0.0,0.0,273000.0,273000.0,273000.0,273000.0,273000.0,273000.0,48968.0,106058.0,0.17937001,2022-11-15,1,4,2023,W,CQ,Negotiate,Americas,US Public and Communications,US Public and Communications,ENTERPRISE,Life Sciences,"AMS for Exponential Tech (Blockchain, IoT etc.)",Custom Application Operations,small,0,0,2023Q4W01,,PFIZER INC,2023-12-22,2023-03-21,AMPS Recipe Authoring Extension Sushma,4,12,13,2023,PFIZER,Intelligent Operations,Application Operations,Custom Application Management Services
7303479,0063h00000JkUHtAAN,0.0,0.0,95238.0,95238.0,95238.0,0.0,95238.0,95238.0,6778.0,10816.0,0.07117167,2022-10-03,1,4,2023,W,CQ,Propose,Japan,JP Insurance,JP INS Other,TARGET PREMIER,Insurance,"OnPrem Application Development, DevOps & Hybrid Integration",Migration & Modernization,small,0,0,2023Q4W01,89,MEIJIYASUDA LIFESYS SO,2023-12-28,2023-09-12,AI for ITを活用した生成AI 活用検討,4,12,14,2023,MEIJI YASUDA LIFE INSURANCE,Strategy & Technology,Hybrid Cloud & Data,Digital Product Design and Engineering
7709173,0063h00000KdRAVAA3,0.0,0.0,0.0,0.0,0.0,0.0,0.0,6000000.0,0.0,0.0,0.0,2023-03-09,1,4,2023,W,CQ,Lost,APAC,ASEAN,Thailand,Unassigned,Select BPS-T,FSCT: Enterprise Transformation with SAP S/4HANA,SAP,small,0,0,2023Q4W01,,PTT DIGITAL SOLUTIONS COMPANY,2023-12-31,2023-08-29,PTT - S4Hana Implemenation,4,12,14,2023,"PTT PUBLIC CO., LTD",Strategy & Technology,Business Applications,Enterprise SAP Transformation
8175192,0063h00000K8WYDAA3,0.0,0.0,666666.0,666666.0,666666.0,0.0,666666.0,666666.0,75638.0,154961.0,0.11345813,2023-07-26,1,4,2023,W,CQ,Propose,Americas,Canada,Canada Quebec,ENTERPRISE,Government,IT: Enterprise Strategy,Enterprise Strategy & Industry,small,0,0,2023Q4W01,Sept 29 Submitted RFP response with IBM Enterprise Strategy team on Aug 24th We received notice that we finished 3rd on price Awaiting final quality score to determine winner which is likely SIA or KPMG,VILLE DE MONTREAL,2023-10-27,2023-09-29,"LGS-VdeM (23-20064) ""Services pro pour la définition des besoins d’affaires pour l’implantation d’un CRM",4,10,5,2023,QUEBEC GOVT,Strategy & Technology,Strategy & Transformation,Strategy & Transformation Offering Top (AUO)
8170222,0063h00000LDa87AAD,0.0,0.0,0.0,9819.0,0.0,0.0,9819.0,9819.0,2652.0,5454.0,0.2700709,2023-07-25,1,4,2023,W,CQ,Qualify,Americas,Canada,Canada Fin,PREMIER,Select Client,Cloud Native App Development,Migration & Modernization,small,0,0,2023Q4W01,,CREDIT UNION CENTRAL ALBERTA,2023-10-20,2023-08-29,"PCR406 - Part 2 - Account Routing Validation (Defect-219, RL-707)",4,10,4,2023,CREDIT UNION CENTRAL ALBERTA,Strategy & Technology,Hybrid Cloud & Data,Digital Product Design and Engineering
8260989,0063h00000MFgvGAAT,0.0,0.0,0.0,0.0,0.0,0.0,0.0,10000000.0,0.0,0.0,0.0,2023-09-19,1,4,2023,W,CQ,Lost,Americas,US Communications & Industrial,US Communications & Industrial,ENTERPRISE,Automotive,CT: Digital Product Engineering,Customer,large,0,0,2023Q4W01,,GENERAL MOTORS LLC,2023-12-08,2023-10-02,OnStar Modernization 2024 - Upside,4,12,11,2023,GENERAL MOTORS,Strategy & Technology,Hybrid Cloud & Data,Digital Product Design and Engineering
8186696,0063h00000LnfFyAAJ,0.0,0.0,0.0,0.0,0.0,0.0,0.0,11733.0,0.0,0.0,0.0,2023-08-25,14,4,2023,W,PQ,Lost,Americas,Canada,Canada Quebec,Unassigned,Digital Squads,DTT: IPC Payments Advisory BPO (Expertus Acq),Enterprise Strategy & Industry,small,0,0,2023Q4W14,,DOREL INDUSTRIES INC,2023-12-31,2023-12-13,Dorel (OSA) - Transition Support,4,12,14,2023,DOREL INDUSTRIES INC,Intelligent Operations,Business Operations,Industry Operations
7906898,0063h00000KzF3QAAV,0.0,0.0,0.0,0.0,0.0,0.0,0.0,720600.0,0.0,0.0,0.0,2023-04-18,14,4,2023,W,PQ,Lost,APAC,ISA,ISA FSS,TARGET PREMIER,Select Technology Sales Rep,CSS: Infra Sec Svcs (C&SI) 6950-31T Withdrawn,CyberDefend,small,0,0,2023Q4W14,,BANK OF INDIA,2023-10-28,2023-07-19,BOI Data Warehouse Upgrade,4,10,5,2023,BANK OF INDIA,Intelligent Operations,Cybersecurity,IBM CyberDefend
7953051,0063h00000KqrZCAAZ,0.0,0.0,0.0,500000.0,0.0,0.0,500000.0,500000.0,38183.0,62224.0,0.07636618,2023-05-25,1,4,2023,W,CQ,Design,Rest of EMEA,DACH,Switzerland,ENTERPRISE,Consumer Products,FSCT: Sustainability for Supply Chains & Proc Withdrawn,Enterprise Strategy,small,0,0,2023Q4W01,,Nestl° Operational Services,2023-11-15,2023-08-29,Sustainability // Scalable LCA,4,11,8,2023,NESTLE,Strategy & Technology,Strategy & Transformation,Supply Chain Transformation
7627180,0063h00000K9oYCAAZ,0.0,0.0,0.0,0.0,0.0,0.0,0.0,2702252.0,0.0,0.0,0.0,2022-12-12,14,4,2023,W,PQ,Lost,APAC,ISA,ISA IND,PREMIER,Select BPS-T,Application Maintenance and Management - Red Hat - OnPrem,Custom Application Operations,large,0,0,2023Q4W14,Another opportunity is there which wil be tracked 0063h00000Kzj0FAAR,ADANI ENTERPRISES LTD,2023-11-29,2023-04-27,AMS  Renewal and Extension to new companies.,4,11,10,2023,ADANI GROUP,Intelligent Operations,Application Operations,Custom Application Management Services
8022018,0063h00000LPlnmAAD,295728.0,295728.0,0.0,295728.0,295728.0,295728.0,0.0,295728.0,0.0,0.0,0.0,2023-06-26,14,4,2023,W,PQ,Won,Rest of EMEA,NCEE,Netherlands,TARGET PREMIER,Select BPS-T,CT: Intelligent Service Transformation,Customer,small,0,0,2023Q4W14,812 Internal CFO contact is needed before he approves stop on all consulting expense but for the ones he approves  112 Executing the BAPO proces internally Schiphol just started yesterday after our escalation Expect PO next week 812,Amsterdam Airport Schiphol,2023-12-22,2023-12-22,CN305 Program Bag2TheFuture,4,12,13,2023,SCHIPHOL,Intelligent Operations,Business Operations,Customer Service Transformation and Operations
304856,0063h00000Fd6vdAAB,0.0,0.0,0.0,0.0,0.0,0.0,0.0,54000.0,0.0,0.0,0.0,2018-05-16,14,4,2023,W,PQ,Lost,Rest of EMEA,NCEE,SweNo,Unassigned,Select BPS-T,"Cyber Risk, Resilience and Compliance 6950-31R",Cyber Strategy & Risk,small,0,0,2023Q4W14,32 We expect the larger RFP will be sent out in Q3 or Q4 and project to start in late 2023 or early 2024,TETRA PAK SVERIGE AB,2023-12-15,2023-08-23,SAP HANA Greenfield - Phase 2,4,12,12,2023,TETRA PAK,Intelligent Operations,Cybersecurity,IBM Cyber Strategy and Risk
8374375,0063h00000MHXkNAAX,50857.0,50857.0,0.0,50857.0,50857.0,50857.0,0.0,50857.0,0.0,0.0,0.0,2023-10-05,14,4,2023,W,PQ,Won,Japan,JP Banking & Financial Markets,JP BKFM Other,ENTERPRISE,Banking,"OnPrem Application Development, DevOps & Hybrid Integration",Migration & Modernization,small,0,0,2023Q4W14,,82 BK,2023-11-24,2023-11-24,RB700導入,4,11,9,2023,82 BANK,Strategy & Technology,Hybrid Cloud & Data,Digital Product Design and Engineering
